Id,Title,Link
32445,A Safety Evaluation of the Resumption of Elective Orthopaedic Services in Higher Risk Patients During the COVID-19 Pandemic,https://www.ncbi.nlm.nih.gov/pmc/articles/PMC8934195/
32446,"“This is most likely not the correct vaccine”: Analyzing COVID-19's viral spread and vaccine anxieties in Ghana, Cameroon, and Malawi",https://www.ncbi.nlm.nih.gov/pmc/articles/PMC10229434/
32447,Target trial emulation with multi-state model analysis to assess treatment effectiveness using clinical COVID-19 data,https://www.ncbi.nlm.nih.gov/pmc/articles/PMC10474639/
32448,The lived experience of people with disabilities during the COVID-19 pandemic on Twitter: Content analysis,https://www.ncbi.nlm.nih.gov/pmc/articles/PMC10286555/
32449,Household resilience among fish value chain actors during the COVID-19 pandemic in Malawi,https://www.ncbi.nlm.nih.gov/pmc/articles/PMC8989685/
32450,Dietary changes among pregnant individuals compared to pre-pandemic: A cross-sectional analysis of the Pregnancy during the COVID-19 Pandemic (PdP) study,https://www.ncbi.nlm.nih.gov/pmc/articles/PMC9751429/
32451,The impact of the COVID-19 pandemic on healthcare access and utilisation in South Sudan: a cross-sectional mixed methods study,https://www.ncbi.nlm.nih.gov/pmc/articles/PMC9765347/
32452,"Working conditions and well-being in UK social care and social work
during COVID-19",https://www.ncbi.nlm.nih.gov/pmc/articles/PMC9264376/
32453,Views on Workplace Policies and its Impact on Health-Related Quality of Life During Coronavirus Disease (COVID-19) Pandemic: Cross-Sectional Survey of Employees,https://www.ncbi.nlm.nih.gov/pmc/articles/PMC9278481/
32454,Examining the Relationship Between Pediatric Behavioral Health and Parent Productivity Through a Parent-Reported Survey in the Time of COVID-19: Exploratory Study,https://www.ncbi.nlm.nih.gov/pmc/articles/PMC9390832/
32455,Impact of the smell loss on the quality of life and adopted coping strategies in COVID-19 patients,https://www.ncbi.nlm.nih.gov/pmc/articles/PMC7814376/
32456,Intranasal neomycin evokes broad-spectrum antiviral immunity in the upper respiratory tract,https://www.ncbi.nlm.nih.gov/pmc/articles/PMC11067057/
32457,Swabbing Thoroughly People for COVID-19 Positivity. Insights on the Main Bio-analytical and Microbiology Bias and Concerns,https://www.ncbi.nlm.nih.gov/pmc/articles/PMC7437638/
32458,Exploring the Lived Experiences of Individuals With Spinal Cord Injury During the COVID-19 Pandemic,https://www.ncbi.nlm.nih.gov/pmc/articles/PMC10807388/
32459,"Mitogen Activated Protein Kinase (MAPK) Activation, p53, and Autophagy Inhibition Characterize the Severe Acute Respiratory Syndrome Coronavirus 2 (SARS-CoV-2) Spike Protein Induced Neurotoxicity",https://www.ncbi.nlm.nih.gov/pmc/articles/PMC9733976/
32460,Conspiracy claims and secret intentions as predictors of psychological coping and vaccine uptake during the COVID-19 pandemic,https://www.ncbi.nlm.nih.gov/pmc/articles/PMC9057981/
32461,"Nationwide Survey on Seasonal Influenza Vaccination among Health Care Workers during the COVID-19 Pandemic in Greece: Determinants, Barriers and Peculiarities",https://www.ncbi.nlm.nih.gov/pmc/articles/PMC10341827/
32462,How Much Do We Care about Teacher Burnout during the Pandemic: A Bibliometric Review,https://www.ncbi.nlm.nih.gov/pmc/articles/PMC9222778/
32463,An Improved Crow Search Optimization with Bi-LSTM Model for Identification and Classification of COVID-19 Infection from Chest X-Ray Images,https://www.ncbi.nlm.nih.gov/pmc/articles/PMC10281227/
32464,Value-based pricing of a COVID-19 vaccine,https://www.ncbi.nlm.nih.gov/pmc/articles/PMC8701763/
32465,Association of Early Steroid Administration With Outcomes of Children Hospitalized for COVID-19 Without Multisystem Inflammatory Syndrome in Children,https://www.ncbi.nlm.nih.gov/pmc/articles/PMC9531079/
32466,Multisystem inflammatory syndrome in children: Is there a linkage to Kawasaki disease?,https://www.ncbi.nlm.nih.gov/pmc/articles/PMC7370900/
32467,"Impact of COVID-19 on vegetable supply chain and food security:
Empirical evidence from Bangladesh",https://www.ncbi.nlm.nih.gov/pmc/articles/PMC7949487/
32468,From policy to practice: a qualitive study exploring the role of community health workers during the COVID-19 response in Sierra Leone,https://www.ncbi.nlm.nih.gov/pmc/articles/PMC10634028/
32469,The intersection of gender and race in older adults’ decision to receive COVID-19 vaccines,https://www.ncbi.nlm.nih.gov/pmc/articles/PMC9485425/
32470,Risk Factors Associated With Increased Ethically Challenging Situations Encountered by Veterinary Team Members During the COVID-19 Pandemic,https://www.ncbi.nlm.nih.gov/pmc/articles/PMC8573112/
32471,Eating disorders in times of the COVID‐19 pandemic—Results from an online survey of patients with anorexia nervosa,https://www.ncbi.nlm.nih.gov/pmc/articles/PMC7461418/
32472,"Stressors and Information-Seeking by Dialysis and Transplant Patients During COVID-19, Reported on a Telephone Hotline: A Mixed-Methods Study",https://www.ncbi.nlm.nih.gov/pmc/articles/PMC9087151/
32473,Plants-Derived Biomolecules as Potent Antiviral Phytomedicines: New Insights on Ethnobotanical Evidences against Coronaviruses,https://www.ncbi.nlm.nih.gov/pmc/articles/PMC7570315/
32474,Prevalence of Mental Health Complaints Among Performing Arts Students Is Associated With COVID-19 Preventive Measures,https://www.ncbi.nlm.nih.gov/pmc/articles/PMC8239520/
32475,Work participation and the COVID-19 pandemic: an observational study in people with inflammatory rheumatic diseases and population controls,https://www.ncbi.nlm.nih.gov/pmc/articles/PMC10987210/
32476,"COVID-19 pandemic and cardiac imaging: EACVI recommendations on precautions, indications, prioritization, and protection for patients and healthcare personnel",https://www.ncbi.nlm.nih.gov/pmc/articles/PMC7184341/
32477,Inpatient Rehabilitation Issues Related to COVID-19,https://www.ncbi.nlm.nih.gov/pmc/articles/PMC10073588/
32478,The SARS-CoV-2 Virus and the Cholinergic System: Spike Protein Interaction with Human Nicotinic Acetylcholine Receptors and the Nicotinic Agonist Varenicline,https://www.ncbi.nlm.nih.gov/pmc/articles/PMC10051900/
32479,Unequal availability of workplace policy for prevention of coronavirus disease 2019 across occupations and its relationship with personal protection behaviours: a cross-sectional survey,https://www.ncbi.nlm.nih.gov/pmc/articles/PMC8422060/
32480,Smart IoMT-based segmentation of coronavirus infections using lung CT scans,https://www.ncbi.nlm.nih.gov/pmc/articles/PMC9935282/
32481,Impact of the COVID-19 pandemic on acute mental health admissions in Croatia,https://www.ncbi.nlm.nih.gov/pmc/articles/PMC10679393/
32482,Anticoagulation Strategies in Critically Ill Patients With SARS-CoV-2 Infection: The Role of Direct Thrombin Inhibitors,https://www.ncbi.nlm.nih.gov/pmc/articles/PMC8902052/
32483,IoMT-fog-cloud based architecture for Covid-19 detection,https://www.ncbi.nlm.nih.gov/pmc/articles/PMC9005369/
32484,"Characterization of Long COVID and Its Contributing Factors among a
Population of Health Care Workers in a 6-Month Follow-up",https://www.ncbi.nlm.nih.gov/pmc/articles/PMC10167639/
32485,A global survey of potential acceptance of a COVID-19 vaccine,https://www.ncbi.nlm.nih.gov/pmc/articles/PMC7573523/
32486,Nat Med. 2021; 27(2): 354. ,https://www.ncbi.nlm.nih.gov/pmc/articles/PMC7799397/
32487,U.S. regional differences in physical distancing: Evaluating racial and socioeconomic divides during the COVID-19 pandemic,https://www.ncbi.nlm.nih.gov/pmc/articles/PMC8631641/
32488,"Recommendations for the recognition, diagnosis, and management of long COVID: a Delphi study",https://www.ncbi.nlm.nih.gov/pmc/articles/PMC8510689/
32489,Prenatal Exposure to COVID-19 mRNA Vaccine BNT162b2 Induces Autism-Like Behaviors in Male Neonatal Rats: Insights into WNT and BDNF Signaling Perturbations,https://www.ncbi.nlm.nih.gov/pmc/articles/PMC10902102/
32490,"Community practices in COVID-19 outbreak in rural Ballabgarh, Haryana – A mixed methods study",https://www.ncbi.nlm.nih.gov/pmc/articles/PMC9638622/
32491,Does Being Ill Improve Acceptance of Medical Technology?—A Patient Survey with the Technology Usage Inventory,https://www.ncbi.nlm.nih.gov/pmc/articles/PMC8431124/
32492,"“Fear and anxiety is what I recall the best."": A phenomenological examination of mothers’ pregnancy experiences during COVID-19 in the United States",https://www.ncbi.nlm.nih.gov/pmc/articles/PMC10112943/
32493,Long COVID Patient Symptoms and its Evaluation and Management,https://www.ncbi.nlm.nih.gov/pmc/articles/PMC9107834/
32494,Protease Inhibition—An Established Strategy to Combat Infectious Diseases,https://www.ncbi.nlm.nih.gov/pmc/articles/PMC8197795/
32495,Healthcare Professionals’ Willingness and Preparedness to Work During COVID-19 in Selected Hospitals of Southwest Ethiopia,https://www.ncbi.nlm.nih.gov/pmc/articles/PMC7868776/
32496,Predictive factors for hospitalization in a cohort of primary healthcare patients with suspected COVID-19,https://www.ncbi.nlm.nih.gov/pmc/articles/PMC9841078/
32497,Emotional Situation of Children and Adolescents during the COVID-19 Pandemic in Germany: Results from the COVID-19 Snapshot Monitoring Study (COSMO),https://www.ncbi.nlm.nih.gov/pmc/articles/PMC8910582/
32498,Computational methods directed towards drug repurposing for COVID-19: advantages and limitations,https://www.ncbi.nlm.nih.gov/pmc/articles/PMC9043418/
32499,The socioeconomic and environmental drivers of the COVID-19 pandemic: A review,https://www.ncbi.nlm.nih.gov/pmc/articles/PMC7841383/
32500,"Parents' employment, income, and finances before and during the COVID‐19 pandemic",https://www.ncbi.nlm.nih.gov/pmc/articles/PMC9115126/
32501,"Understanding the impact of the COVID-19 pandemic response on GI infection surveillance trends in England, January 2020–April 2022",https://www.ncbi.nlm.nih.gov/pmc/articles/PMC10540168/
32502,Perceived Impact of the COVID-19 Pandemic on Adults with Intellectual and Developmental Disability: A Qualitative Study,https://www.ncbi.nlm.nih.gov/pmc/articles/PMC9755036/
32503,Nurses’ willingness to work with COVID‐19 patients: The role of knowledge and attitude,https://www.ncbi.nlm.nih.gov/pmc/articles/PMC7877123/
32504,Theory and Practice of Aging during the COVID-19 Pandemic,https://www.ncbi.nlm.nih.gov/pmc/articles/PMC7724777/
32505,"The insomnia, fatigue, and psychological well‐being of hospital nurses 18 months after the COVID‐19 pandemic began: A cross‐sectional study",https://www.ncbi.nlm.nih.gov/pmc/articles/PMC9349539/
32506,Riboflavin for COVID-19 Adjuvant Treatment in Patients With Mental Health Disorders: Observational Study,https://www.ncbi.nlm.nih.gov/pmc/articles/PMC8960625/
32507,COVID-19 and its implications on the clinico-radiological course of multiple sclerosis: A case–control study,https://www.ncbi.nlm.nih.gov/pmc/articles/PMC9364744/
32508,Levels and Factors Associated with Resilience in Italian Healthcare Professionals during the COVID-19 Pandemic: A Web-Based Survey,https://www.ncbi.nlm.nih.gov/pmc/articles/PMC7760580/
32509,Being a health care professional in the ICU serving patients with covid-19: A qualitative study,https://www.ncbi.nlm.nih.gov/pmc/articles/PMC9334934/
32510,Severe Fatigue and Memory Impairment Are Associated with Lower Serum Level of Anti-SARS-CoV-2 Antibodies in Patients with Post-COVID Symptoms,https://www.ncbi.nlm.nih.gov/pmc/articles/PMC8509483/
32511,SARS-CoV2 infection induce miR-155 expression and skewed Th17/Treg balance by changing SOCS1 level: A clinical study,https://www.ncbi.nlm.nih.gov/pmc/articles/PMC10247889/
32512,Narratives and counter-narratives in religious responses to COVID-19: A computational text analysis,https://www.ncbi.nlm.nih.gov/pmc/articles/PMC8812967/
32513,Mucormycosis: A triple burden in patients with diabetes during COVID-19 Pandemic,https://www.ncbi.nlm.nih.gov/pmc/articles/PMC8639489/
32514,Personal Social Networks of Community-Dwelling Oldest Old During the Covid-19 Pandemic—A Qualitative Study,https://www.ncbi.nlm.nih.gov/pmc/articles/PMC8739883/
32515,Investigation of turning points in the effectiveness of Covid-19 social distancing,https://www.ncbi.nlm.nih.gov/pmc/articles/PMC9588076/
32516,What workers can tell us about post-COVID workability,https://www.ncbi.nlm.nih.gov/pmc/articles/PMC9384751/
32517,Application of a High-Content Screening Assay Utilizing Primary Human Lung Fibroblasts to Identify Antifibrotic Drugs for Rapid Repurposing in COVID-19 Patients,https://www.ncbi.nlm.nih.gov/pmc/articles/PMC8458684/
32518,Cerebral ischemic and hemorrhagic complications of coronavirus disease 2019,https://www.ncbi.nlm.nih.gov/pmc/articles/PMC7534206/
32519,Immunogenicity and reactogenicity of heterologous and homologous mRNA-1273 and BNT162b2 vaccination: A multicenter non-inferiority randomized trial,https://www.ncbi.nlm.nih.gov/pmc/articles/PMC9098199/
32520,"Clinical progression of patients with COVID-19 in Lagos State, Nigeria",https://www.ncbi.nlm.nih.gov/pmc/articles/PMC8418277/
32521,Importance of collecting data on socioeconomic determinants from the early stage of the COVID-19 outbreak onwards,https://www.ncbi.nlm.nih.gov/pmc/articles/PMC7298202/
32522,HQDCNet: Hybrid Quantum Dilated Convolution Neural Network for detecting covid-19 in the context of Big Data Analytics,https://www.ncbi.nlm.nih.gov/pmc/articles/PMC10176300/
32523,Nutritional priorities in patients with severe COVID-19,https://www.ncbi.nlm.nih.gov/pmc/articles/PMC9247039/
32524,Exploring Political Mistrust in Pandemic Risk Communication: Mixed-Method Study Using Social Media Data Analysis,https://www.ncbi.nlm.nih.gov/pmc/articles/PMC10625074/
32525,Case reports of management of aplastic anemia after COVID-19 vaccination: a single institute experience in Taiwan,https://www.ncbi.nlm.nih.gov/pmc/articles/PMC9440996/
32526,Prioritisation of outpatient appointments and elective surgery in gynaecology,https://www.ncbi.nlm.nih.gov/pmc/articles/PMC7970415/
32527,"The Interactions of Food Security, Health, and Loneliness among Rural Older Adults before and after the Onset of COVID-19",https://www.ncbi.nlm.nih.gov/pmc/articles/PMC9739434/
32528,Adverse events and preventive measures related to COVID-19 vaccines,https://www.ncbi.nlm.nih.gov/pmc/articles/PMC8517461/
32529,"The Impact of Age and Gender and Their Association with Chemosensory Dysfunction, in Hospitalized and Self-Quarantine Patients with Covid-19 Infection, in Epirus, Greece",https://www.ncbi.nlm.nih.gov/pmc/articles/PMC9168572/
32530,Experiences and needs of direct support staff working with people with intellectual disabilities during the COVID‐19 pandemic: A thematic analysis,https://www.ncbi.nlm.nih.gov/pmc/articles/PMC7537186/
32531,Predicting COVID-19 outcomes with the Edmonton Obesity Staging System,https://www.ncbi.nlm.nih.gov/pmc/articles/PMC11016153/
32532,Gender effects of the COVID-19 pandemic in the Swiss labor market,https://www.ncbi.nlm.nih.gov/pmc/articles/PMC9734706/
32533,"Examining the Stress, Coping and Trust Levels of Turkish Healthcare Professionals During the COVID-19 Pandemic Process",https://www.ncbi.nlm.nih.gov/pmc/articles/PMC8325774/
32534,Clinical characteristics of coronavirus disease 2019 in patients aged 80 years and older,https://www.ncbi.nlm.nih.gov/pmc/articles/PMC7347492/
32535,Metrics and indicators used to assess health system resilience in response to shocks to health systems in high income countries—A systematic review,https://www.ncbi.nlm.nih.gov/pmc/articles/PMC9556803/
32536,Effects of COVID-19 on Sense of Smell: Human Factors/Ergonomics Considerations,https://www.ncbi.nlm.nih.gov/pmc/articles/PMC7902264/
32537,A Survey on AI Techniques for Thoracic Diseases Diagnosis Using Medical Images,https://www.ncbi.nlm.nih.gov/pmc/articles/PMC9777249/
32538,Application of the Policy Regime Framework to understand COVID-19 policy response in the Southeast U.S.: How RAPID research can provide lessons learned after a public health crisis,https://www.ncbi.nlm.nih.gov/pmc/articles/PMC9791194/
32539,Recovery of a patient with severe COVID-19 by acupuncture and Chinese herbal medicine adjuvant to standard care,https://www.ncbi.nlm.nih.gov/pmc/articles/PMC8186062/
32540,Risk perception of Ebola virus disease and COVID-19 among transport drivers living in Ugandan border districts,https://www.ncbi.nlm.nih.gov/pmc/articles/PMC10308013/
32541,A Study on AI‐based Waste Management Strategies for the COVID‐19 Pandemic,https://www.ncbi.nlm.nih.gov/pmc/articles/PMC9083818/
32542,Israeli Health Care Social Workers’ Personal and Professional Concerns during the COVID-19 Pandemic Crisis: The Work–Family Role Conflict,https://www.ncbi.nlm.nih.gov/pmc/articles/PMC8344873/
32543,Nafamostat reduces systemic inflammation in TLR7-mediated virus-like illness,https://www.ncbi.nlm.nih.gov/pmc/articles/PMC8734544/
32544,Healthcare professionals’ families’ perception of life during COVID-19 in Iran: a qualitative study,https://www.ncbi.nlm.nih.gov/pmc/articles/PMC8992355/
32545,Effect of Covid-19 pandemic on tourist travel risk and management perceptions,https://www.ncbi.nlm.nih.gov/pmc/articles/PMC8409625/
32546,Risk and protection factors of mental stress among medical staff in the third year of the COVID-19 pandemic,https://www.ncbi.nlm.nih.gov/pmc/articles/PMC10995372/
32547,Sentiment Analysis on COVID-19 Twitter Data Streams Using Deep Belief Neural Networks,https://www.ncbi.nlm.nih.gov/pmc/articles/PMC9077450/
32548,Comput Intell Neurosci. 2023; 2023: 9785326. ,https://www.ncbi.nlm.nih.gov/pmc/articles/PMC10586339/
32549,"Evaluating socioeconomic inequalities in influenza vaccine uptake during the COVID-19 pandemic: A cohort study in Greater Manchester, England",https://www.ncbi.nlm.nih.gov/pmc/articles/PMC10522043/
32550,The mental health impact of COVID-19 and lockdown-related stressors among adults in the UK,https://www.ncbi.nlm.nih.gov/pmc/articles/PMC7783135/
32551,"Analysis, modeling and optimal control of COVID-19 outbreak with three forms of infection in Democratic Republic of the Congo",https://www.ncbi.nlm.nih.gov/pmc/articles/PMC7999905/
32552,"Covid-19-induced Shocks, Access to Basic Needs and Coping Strategies",https://www.ncbi.nlm.nih.gov/pmc/articles/PMC10147996/
32553,What items should be included in an early warning score for remote assessment of suspected COVID-19? qualitative and Delphi study,https://www.ncbi.nlm.nih.gov/pmc/articles/PMC7662139/
32554,Association between reasons for not working and reporting of major depression and anxiety symptoms among U.S. adult population during the COVID-19 pandemic,https://www.ncbi.nlm.nih.gov/pmc/articles/PMC10440807/
32555,The Association between Mental Health Symptoms and Quality and Safety of Patient Care before and during COVID-19 among Canadian Nurses,https://www.ncbi.nlm.nih.gov/pmc/articles/PMC8871834/
32556,"Correlation of AKI with Risk Factors, Ventilatory Support, Renal Replacement Therapy in a Cohort of COVID-19 Patients",https://www.ncbi.nlm.nih.gov/pmc/articles/PMC9365008/
32557,Implications of the COVID-19 Pandemic on the Mental Health and Professional Psychomotor Skills of Dental Students,https://www.ncbi.nlm.nih.gov/pmc/articles/PMC8184245/
32558,Living Well as a Muslim through the Pandemic Era—A Qualitative Study in Japan,https://www.ncbi.nlm.nih.gov/pmc/articles/PMC9140639/
32559,HIV epidemic amidst COVID-19 pandemic in India: a conundrum for the country's healthcare system,https://www.ncbi.nlm.nih.gov/pmc/articles/PMC9203355/
32560,"Fast, furious and focused approach to Covid-19 response: an examination of the financial and business resilience of the UAE logistics industry",https://www.ncbi.nlm.nih.gov/pmc/articles/PMC8548861/
32561,Emergency department visits of newly diagnosed cardiovascular disease patients in Korea during the COVID-19 pandemic,https://www.ncbi.nlm.nih.gov/pmc/articles/PMC10764744/
32562,Prediction of low pulse oxygen saturation in COVID-19 using remote monitoring post hospital discharge,https://www.ncbi.nlm.nih.gov/pmc/articles/PMC9625852/
32563,Significance of Chronic Kidney Disease on Morbidity and Mortality in Hospitalized Patients With COVID-19,https://www.ncbi.nlm.nih.gov/pmc/articles/PMC10783563/
32564,Body care activities and its consequences related to COVID‐19 pandemic,https://www.ncbi.nlm.nih.gov/pmc/articles/PMC9538522/
32565,Search and reallocation in the COVID-19 pandemic: Evidence from the UK,https://www.ncbi.nlm.nih.gov/pmc/articles/PMC9837231/
32566,Sources of meaning in life among older adults during the COVID‐19 pandemic: A qualitative study,https://www.ncbi.nlm.nih.gov/pmc/articles/PMC10563418/
32567,Potential Diagnostic Systems for Coronavirus Detection: a Critical Review,https://www.ncbi.nlm.nih.gov/pmc/articles/PMC7462115/
32568,SARS-CoV-2 infection induces protective immunity and limits transmission in Syrian hamsters,https://www.ncbi.nlm.nih.gov/pmc/articles/PMC7893819/
32569,Factors Contributing to Burnout among Healthcare Workers during COVID-19 in Sabah (East Malaysia),https://www.ncbi.nlm.nih.gov/pmc/articles/PMC9222411/
32570,Addressing a national crisis: the spine hospital and department's response to the COVID-19 pandemic in New York City,https://www.ncbi.nlm.nih.gov/pmc/articles/PMC7261362/
32571,A content-based analysis to identify the influence of COVID-19 on sharing economy activities,https://www.ncbi.nlm.nih.gov/pmc/articles/PMC8820359/
32572,Isolation of Pseudomonas aeruginosa from Persistent Bacterial Coinfection of a COVID-19 Patients with Molecular Detection of Antibiotics Resistance Genes,https://www.ncbi.nlm.nih.gov/pmc/articles/PMC10258303/
32573,"The relationship between resilience, anxiety and depression among patients with mild symptoms of COVID‐19 in China: A cross‐sectional study",https://www.ncbi.nlm.nih.gov/pmc/articles/PMC7404600/
32574,Social distancing laws cause only small losses of economic activity during the COVID-19 pandemic in Scandinavia,https://www.ncbi.nlm.nih.gov/pmc/articles/PMC7456178/
32575,"Health workforce incentives and dis-incentives during the COVID-19 pandemic: experiences from Democratic Republic of Congo, Nigeria, Senegal, and Uganda",https://www.ncbi.nlm.nih.gov/pmc/articles/PMC10993439/
32576,What do times of crisis reveal about the ‘Total’ nature of prisons? Analysing the impacts of the COVID-19 crisis within the Scottish prison system,https://www.ncbi.nlm.nih.gov/pmc/articles/PMC10051006/
32577,Mutant metaphors: Frankenstein in the era of COVID-19,https://www.ncbi.nlm.nih.gov/pmc/articles/PMC10359555/
32578,"Reducing sick leave, improving work ability, and quality of life in patients with mild to moderate Long COVID through psychosocial, physiotherapeutic, and nutritive supportive digital intervention (MiLoCoDaS): study protocol for a randomized controlled trial",https://www.ncbi.nlm.nih.gov/pmc/articles/PMC10709981/
32579,COVID-19: An International Public Health Concern,https://www.ncbi.nlm.nih.gov/pmc/articles/PMC7538874/
32580,Scoping the impact of COVID-19 on the nexus of statelessness and health in Council of Europe member states,https://www.ncbi.nlm.nih.gov/pmc/articles/PMC8352077/
32581,J Migr Health. 2021; 4: 100063. ,https://www.ncbi.nlm.nih.gov/pmc/articles/PMC8441190/
32582,Outcomes of Patients With Hypothyroidism and COVID-19: A Retrospective Cohort Study,https://www.ncbi.nlm.nih.gov/pmc/articles/PMC7461836/
32583,Perceptions Regarding COVID-19 Vaccination Among a Representative Pakistani Population Coming to Tertiary Care Cardiac Hospital,https://www.ncbi.nlm.nih.gov/pmc/articles/PMC8583356/
32584,Impact of COVID-19 on Undergraduate Nursing Education: Student Perspectives,https://www.ncbi.nlm.nih.gov/pmc/articles/PMC8855759/
32585,The influence of COVID-19 pandemic and coping strategies on work operation of nonfarm household enterprises in Nigeria,https://www.ncbi.nlm.nih.gov/pmc/articles/PMC10066960/
32586,Common Coagulopathies Associated With COVID-19 Patients,https://www.ncbi.nlm.nih.gov/pmc/articles/PMC10208414/
32587,"Impacts of COVID‐19 on global poverty, food security, and diets: Insights from global model scenario analysis",https://www.ncbi.nlm.nih.gov/pmc/articles/PMC8251321/
32588,Responding to the COVID‐19 pandemic: The role of occupational health services in a tertiary hospital in Singapore,https://www.ncbi.nlm.nih.gov/pmc/articles/PMC7557359/
32589,Exploring the impact of Covid-19 on the care and quality of life of people with dementia and their carers: A scoping review,https://www.ncbi.nlm.nih.gov/pmc/articles/PMC8811334/
32590,Handling the COVID‐19 crisis: Toward an agile model‐based systems approach,https://www.ncbi.nlm.nih.gov/pmc/articles/PMC7461451/
32591,Safely reducing haemodialysis frequency during the COVID-19 pandemic,https://www.ncbi.nlm.nih.gov/pmc/articles/PMC7720264/
32592,Follow-up regimes for sick-listed employees: A comparison of nine north-western European countries,https://www.ncbi.nlm.nih.gov/pmc/articles/PMC9085445/
32593,Global impact of COVID-19 on surgeons and team members (GlobalCOST): a cross-sectional study,https://www.ncbi.nlm.nih.gov/pmc/articles/PMC9361744/
32594,Potential therapeutic use of corticosteroids as SARS CoV-2 main protease inhibitors: a computational study,https://www.ncbi.nlm.nih.gov/pmc/articles/PMC7596904/
32595,Treatment of Coronavirus Disease 2019: Shooting in the Dark,https://www.ncbi.nlm.nih.gov/pmc/articles/PMC7479539/
32596,COVID-19 and Collective Transformation: Changes in Online Nursing Faculty Pedagogical Practices,https://www.ncbi.nlm.nih.gov/pmc/articles/PMC10271816/
32597,Estimating the Impact of Covid-19 and Policy Responses on Australian Income Distribution Using Incomplete Data,https://www.ncbi.nlm.nih.gov/pmc/articles/PMC8546393/
