Id,Title,Link
30000,SARS‐CoV‐2‐neutralising monoclonal antibodies to prevent COVID‐19,https://www.ncbi.nlm.nih.gov/pmc/articles/PMC9205158/
30001,Recent developments in the immunopathology of COVID‐19,https://www.ncbi.nlm.nih.gov/pmc/articles/PMC10108124/
30002,The Impact of COVID-19 on People Living with HIV-1 and HIV-1-Associated Neurological Complications,https://www.ncbi.nlm.nih.gov/pmc/articles/PMC10223371/
30003,Targeting autophagy regulation in NLRP3 inflammasome-mediated lung inflammation in COVID-19,https://www.ncbi.nlm.nih.gov/pmc/articles/PMC9356669/
30004,COVID-19: systemic pathology and its implications for therapy,https://www.ncbi.nlm.nih.gov/pmc/articles/PMC8692150/
30005,"COVID-19: Immunology, Immunopathogenesis and Potential Therapies",https://www.ncbi.nlm.nih.gov/pmc/articles/PMC7919479/
30006,Therapeutic trials for long COVID-19: A call to action from the interventions taskforce of the RECOVER initiative,https://www.ncbi.nlm.nih.gov/pmc/articles/PMC10034329/
30007,Protecting Nursing Homes and Long-Term Care Facilities From COVID-19: A Rapid Review of International Evidence,https://www.ncbi.nlm.nih.gov/pmc/articles/PMC8328566/
30008,"Meet changes with constancy: Defence, antagonism, recovery, and immunity roles of extracellular vesicles in confronting SARS‐CoV‐2",https://www.ncbi.nlm.nih.gov/pmc/articles/PMC9712136/
30009,Biological and Psychological Factors Determining Neuropsychiatric Outcomes in COVID-19,https://www.ncbi.nlm.nih.gov/pmc/articles/PMC8485771/
30010,The deciphering of the immune cells and marker signature in COVID‐19 pathogenesis: An update,https://www.ncbi.nlm.nih.gov/pmc/articles/PMC9350195/
30011,"Persistent SARS-CoV-2 Infection, EBV, HHV-6 and Other Factors May Contribute to Inflammation and Autoimmunity in Long COVID",https://www.ncbi.nlm.nih.gov/pmc/articles/PMC9967513/
30012,COVID-19 associated thyroid dysfunction and other comorbidities and its management using phytochemical-based therapeutics: a natural way,https://www.ncbi.nlm.nih.gov/pmc/articles/PMC10372472/
30013,"COVID-19, post-acute COVID-19 syndrome (PACS, “long COVID”) and post-COVID-19 vaccination syndrome (PCVS, “post-COVIDvac-syndrome”): Similarities and differences",https://www.ncbi.nlm.nih.gov/pmc/articles/PMC10154064/
30014,Potential for Early Noninvasive COVID-19 Detection Using Electronic-Nose Technologies and Disease-Specific VOC Metabolic Biomarkers,https://www.ncbi.nlm.nih.gov/pmc/articles/PMC10054641/
30015,COVID-19 and severity of liver diseases: Possible crosstalk and clinical implications,https://www.ncbi.nlm.nih.gov/pmc/articles/PMC10247890/
30016,"Neurological manifestations of SARS-CoV-2: complexity, mechanism and associated disorders",https://www.ncbi.nlm.nih.gov/pmc/articles/PMC10469568/
30017,Neurological complications associated with Covid‐19; molecular mechanisms and therapeutic approaches,https://www.ncbi.nlm.nih.gov/pmc/articles/PMC9111040/
30018,The Nervous System During COVID-19: Caught in the Crossfire,https://www.ncbi.nlm.nih.gov/pmc/articles/PMC9350403/
30019,"Wastewater, waste, and water-based epidemiology (WWW-BE): A novel hypothesis and decision-support tool to unravel COVID-19 in low-income settings?",https://www.ncbi.nlm.nih.gov/pmc/articles/PMC8481624/
30020,The COVID-19 pandemic and Alzheimer’s disease: mutual risks and mechanisms,https://www.ncbi.nlm.nih.gov/pmc/articles/PMC9464468/
30021,"The Natural History, Pathobiology, and Clinical Manifestations of SARS-CoV-2 Infections",https://www.ncbi.nlm.nih.gov/pmc/articles/PMC7373339/
30022,"Covid-19: pharmacotherapeutic insights on various curative approaches in terms of vulnerability, comorbidities, and vaccination",https://www.ncbi.nlm.nih.gov/pmc/articles/PMC8722419/
30023,Understanding COVID-19-associated coagulopathy,https://www.ncbi.nlm.nih.gov/pmc/articles/PMC9362465/
30024,The Role of Immunity in the Pathogenesis of SARS-CoV-2 Infection and in the Protection Generated by COVID-19 Vaccines in Different Age Groups,https://www.ncbi.nlm.nih.gov/pmc/articles/PMC9967364/
30025,"From Co-Infections to Autoimmune Disease via Hyperactivated Innate Immunity: COVID-19 Autoimmune Coagulopathies, Autoimmune Myocarditis and Multisystem Inflammatory Syndrome in Children",https://www.ncbi.nlm.nih.gov/pmc/articles/PMC9917907/
30026,"2022 ACC Expert Consensus Decision Pathway on Cardiovascular Sequelae of COVID-19 in Adults: Myocarditis and Other Myocardial Involvement, Post-Acute Sequelae of SARS-CoV-2 Infection, and Return to Play: A Report of the American College of Cardiology Solution Set Oversight Committee",https://www.ncbi.nlm.nih.gov/pmc/articles/PMC8926109/
30027,Pathogenic mechanisms of post-acute sequelae of SARS-CoV-2 infection (PASC),https://www.ncbi.nlm.nih.gov/pmc/articles/PMC10032659/
30028,COVID-19: An Overview of SARS-CoV-2 Variants—The Current Vaccines and Drug Development,https://www.ncbi.nlm.nih.gov/pmc/articles/PMC10480030/
30029,An integrative look at SARS-CoV-2 (Review),https://www.ncbi.nlm.nih.gov/pmc/articles/PMC7797443/
30030,SARS‐CoV‐2‐neutralising monoclonal antibodies for treatment of COVID‐19,https://www.ncbi.nlm.nih.gov/pmc/articles/PMC8411904/
30031,Experimental Models of COVID-19,https://www.ncbi.nlm.nih.gov/pmc/articles/PMC8791197/
30032,SARS-CoV-2 infection and multi-organ system damage: A review,https://www.ncbi.nlm.nih.gov/pmc/articles/PMC9901898/
30033,COVID-19 vaccination significantly reduces morbidity and absenteeism among healthcare personnel: A prospective multicenter study,https://www.ncbi.nlm.nih.gov/pmc/articles/PMC8556541/
30034,COVID-19 Infection and Circulating Microparticles—Reviewing Evidence as Microthrombogenic Risk Factor for Cerebral Small Vessel Disease,https://www.ncbi.nlm.nih.gov/pmc/articles/PMC8235918/
30035,Humans with inherited MyD88 and IRAK-4 deficiencies are predisposed to hypoxemic COVID-19 pneumonia,https://www.ncbi.nlm.nih.gov/pmc/articles/PMC9998661/
30036,The Omic Insights on Unfolding Saga of COVID-19,https://www.ncbi.nlm.nih.gov/pmc/articles/PMC8564481/
30037,"Inflammation, immunity and potential target therapy of SARS-COV-2: A total scale analysis review",https://www.ncbi.nlm.nih.gov/pmc/articles/PMC7905385/
30038,BCG Vaccination: A potential tool against COVID-19 and COVID-19-like Black Swan incidents,https://www.ncbi.nlm.nih.gov/pmc/articles/PMC9113676/
30039,Development trends of human organoid‐based COVID‐19 research based on bibliometric analysis,https://www.ncbi.nlm.nih.gov/pmc/articles/PMC10693193/
30040,Long COVID endotheliopathy: hypothesized mechanisms and potential therapeutic approaches,https://www.ncbi.nlm.nih.gov/pmc/articles/PMC9337829/
30041,"Association of
COVID-19 with Comorbidities: An Update",https://www.ncbi.nlm.nih.gov/pmc/articles/PMC10000013/
30042,A comparison of conventional and advanced electroanalytical methods to detect SARS-CoV-2 virus: A concise review,https://www.ncbi.nlm.nih.gov/pmc/articles/PMC9270057/
30043,Wastewater surveillance to infer COVID-19 transmission: A systematic review,https://www.ncbi.nlm.nih.gov/pmc/articles/PMC8423771/
30044,Role of SARS-CoV-2 Spike-Protein-Induced Activation of Microglia and Mast Cells in the Pathogenesis of Neuro-COVID,https://www.ncbi.nlm.nih.gov/pmc/articles/PMC10001285/
30045,"Role of Diet and Nutrients in SARS-CoV-2 Infection: Incidence on Oxidative Stress, Inflammatory Status and Viral Production",https://www.ncbi.nlm.nih.gov/pmc/articles/PMC9182601/
30046,Rationale for combined therapies in severe-to-critical COVID-19 patients,https://www.ncbi.nlm.nih.gov/pmc/articles/PMC10520558/
30047,Exploring the immunogenic properties of SARS-CoV-2 structural proteins: PAMP:TLR signaling in the mediation of the neuroinflammatory and neurologic sequelae of COVID-19,https://www.ncbi.nlm.nih.gov/pmc/articles/PMC10132835/
30048,Wuhan to World: The COVID-19 Pandemic,https://www.ncbi.nlm.nih.gov/pmc/articles/PMC8042280/
30049,From Emergence to Endemicity: A Comprehensive Review of COVID-19,https://www.ncbi.nlm.nih.gov/pmc/articles/PMC10617653/
30050,Coronavirus Disease (COVID-19) Control between Drug Repurposing and Vaccination: A Comprehensive Overview,https://www.ncbi.nlm.nih.gov/pmc/articles/PMC8622998/
30051,Nano-based techniques: A revolutionary approach to prevent covid-19 and enhancing human awareness,https://www.ncbi.nlm.nih.gov/pmc/articles/PMC10183109/
30052,"Efficacy of mRNA, adenoviral vector, and perfusion protein COVID-19 vaccines",https://www.ncbi.nlm.nih.gov/pmc/articles/PMC8660177/
30053,The find of COVID-19 vaccine: Challenges and opportunities,https://www.ncbi.nlm.nih.gov/pmc/articles/PMC7773313/
30054,Inflammasomes: a rising star on the horizon of COVID-19 pathophysiology,https://www.ncbi.nlm.nih.gov/pmc/articles/PMC10213254/
30055,Bioinformatics and systems biology approaches to identify the effects of COVID-19 on neurodegenerative diseases: A review,https://www.ncbi.nlm.nih.gov/pmc/articles/PMC9750669/
30056,Adaptive immunity to SARS-CoV-2 infection: A systematic review,https://www.ncbi.nlm.nih.gov/pmc/articles/PMC9589156/
30057,The COVID-19 pandemic and its implications on the environment,https://www.ncbi.nlm.nih.gov/pmc/articles/PMC8261195/
30058,The Pathophysiology of Long COVID throughout the Renin-Angiotensin System,https://www.ncbi.nlm.nih.gov/pmc/articles/PMC9101946/
30059,Narrative Review of New Insight into the Influence of the COVID-19 Pandemic on Cardiovascular Care,https://www.ncbi.nlm.nih.gov/pmc/articles/PMC9694465/
30060,The Intersection of COVID-19 and Metabolic-Associated Fatty Liver Disease: An Overview of the Current Evidence,https://www.ncbi.nlm.nih.gov/pmc/articles/PMC10221350/
30061,A review about COVID-19 in the MENA region: environmental concerns and machine learning applications,https://www.ncbi.nlm.nih.gov/pmc/articles/PMC9554385/
30062,Exploring the Role of ACE2 as a Connecting Link between COVID-19 and Parkinson’s Disease,https://www.ncbi.nlm.nih.gov/pmc/articles/PMC9961012/
30063,What SARS-CoV-2 does to our brains,https://www.ncbi.nlm.nih.gov/pmc/articles/PMC9212726/
30064,Immunosenescence and inflamm-ageing in COVID-19,https://www.ncbi.nlm.nih.gov/pmc/articles/PMC9741765/
30065,Bioactive Molecules Derived from Snake Venoms with Therapeutic Potential for the Treatment of Thrombo-Cardiovascular Disorders Associated with COVID-19,https://www.ncbi.nlm.nih.gov/pmc/articles/PMC8427918/
30066,A Comprehensive Review on the Efficacy of Several Pharmacologic Agents for the Treatment of COVID-19,https://www.ncbi.nlm.nih.gov/pmc/articles/PMC9692303/
30067,Socio-demographic Heterogeneity in Prevalence of SARS-COV-2 Infection and Death Rate: Relevance to Black College Student Knowledge of COVID-19 and SARS-COV-2,https://www.ncbi.nlm.nih.gov/pmc/articles/PMC8815385/
30068,Pulmonary function testing during SARS‐CoV‐2: An ANZSRS/TSANZ position statement,https://www.ncbi.nlm.nih.gov/pmc/articles/PMC9539179/
30069,SARS-CoV-2 Spike protein induces TLR4-mediated long-term cognitive dysfunction recapitulating post-COVID-19 syndrome in mice,https://www.ncbi.nlm.nih.gov/pmc/articles/PMC9935273/
30070,Vitamin D—A prominent immunomodulator to prevent COVID‐19 infection,https://www.ncbi.nlm.nih.gov/pmc/articles/PMC9874620/
30071,Coronavirus disease 2019 (COVID-19): Biophysical and biochemical aspects of SARS-CoV-2 and general characteristics,https://www.ncbi.nlm.nih.gov/pmc/articles/PMC8142027/
30072,Biological Properties of SARS-CoV-2 Variants: Epidemiological Impact and Clinical Consequences,https://www.ncbi.nlm.nih.gov/pmc/articles/PMC9230982/
30073,Co-infection associated with SARS-CoV-2 and their management,https://www.ncbi.nlm.nih.gov/pmc/articles/PMC9912272/
30074,"SARS‐CoV‐2, COVID‐19, skin and immunology – What do we know so far?",https://www.ncbi.nlm.nih.gov/pmc/articles/PMC7404682/
30075,Fast-track development of vaccines for SARS-CoV-2: The shots that saved the world,https://www.ncbi.nlm.nih.gov/pmc/articles/PMC9574046/
30076,An overview of viral mutagenesis and the impact on pathogenesis of SARS-CoV-2 variants,https://www.ncbi.nlm.nih.gov/pmc/articles/PMC9742215/
30077,Severe COVID-19: Drugs and Clinical Trials,https://www.ncbi.nlm.nih.gov/pmc/articles/PMC10142549/
30078,Recent Advancements on COVID-19: A Comprehensive Review,https://www.ncbi.nlm.nih.gov/pmc/articles/PMC8713878/
30079,An update on emerging therapeutics to combat COVID‐19,https://www.ncbi.nlm.nih.gov/pmc/articles/PMC8239852/
30080,Drugs targeting various stages of the SARS-CoV-2 life cycle: Exploring promising drugs for the treatment of Covid-19,https://www.ncbi.nlm.nih.gov/pmc/articles/PMC7375293/
30081,"In COVID-19, NLRP3 inflammasome genetic variants are associated with critical disease and these effects are partly mediated by the sickness symptom complex: a nomothetic network approach",https://www.ncbi.nlm.nih.gov/pmc/articles/PMC8752583/
30082,COVID-19-related anosmia is associated with viral persistence and inflammation in human olfactory epithelium and brain infection in hamsters,https://www.ncbi.nlm.nih.gov/pmc/articles/PMC8158965/
30083,Safety and COVID-19 Symptoms in Individuals Recently Vaccinated with BCG: a Retrospective Cohort Study,https://www.ncbi.nlm.nih.gov/pmc/articles/PMC7405881/
30084,The Impact of COVID-19 On Comorbidities: A Review Of Recent Updates For Combating It,https://www.ncbi.nlm.nih.gov/pmc/articles/PMC8828435/
30085,Involvement of the nervous system in COVID-19: The bell should toll in the brain,https://www.ncbi.nlm.nih.gov/pmc/articles/PMC7537730/
30086,Neuroinflammation and COVID-19,https://www.ncbi.nlm.nih.gov/pmc/articles/PMC9239981/
30087,Gut Microbiota Disruption in COVID-19 or Post-COVID Illness Association with severity biomarkers: A Possible Role of Pre / Pro-biotics in manipulating microflora,https://www.ncbi.nlm.nih.gov/pmc/articles/PMC8934739/
30088,COVID-19 and Alzheimer’s disease: how one crisis worsens the other,https://www.ncbi.nlm.nih.gov/pmc/articles/PMC8090526/
30089,COVID‐19‐related neuropathology and microglial activation in elderly with and without dementia,https://www.ncbi.nlm.nih.gov/pmc/articles/PMC8412067/
30090,Systematic review and meta-analysis of human genetic variants contributing to COVID-19 susceptibility and severity,https://www.ncbi.nlm.nih.gov/pmc/articles/PMC9384365/
30091,Post-COVID-19 Parkinsonism and Parkinson’s Disease Pathogenesis: The Exosomal Cargo Hypothesis,https://www.ncbi.nlm.nih.gov/pmc/articles/PMC9456372/
30092,"Comorbidities, Associated Diseases, and Risk Assessment in COVID-19—A Systematic Review",https://www.ncbi.nlm.nih.gov/pmc/articles/PMC9640235/
30093,"COVID-19: molecular targets, drug repurposing and new avenues for
drug discovery",https://www.ncbi.nlm.nih.gov/pmc/articles/PMC7534958/
30094,Reviving the mutual impact of SARS-COV-2 and obesity on patients: From morbidity to mortality,https://www.ncbi.nlm.nih.gov/pmc/articles/PMC9127128/
30095,Commonalities Between COVID-19 and Radiation Injury,https://www.ncbi.nlm.nih.gov/pmc/articles/PMC7861125/
30096,Self-DNA driven inflammation in COVID-19 and after mRNA-based vaccination: lessons for non-COVID-19 pathologies,https://www.ncbi.nlm.nih.gov/pmc/articles/PMC10910434/
30097,Role of neuroinflammation mediated potential alterations in adult neurogenesis as a factor for neuropsychiatric symptoms in Post-Acute COVID-19 syndrome—A narrative review,https://www.ncbi.nlm.nih.gov/pmc/articles/PMC9639419/
30098,SARS-CoV-2 Antiviral Therapy,https://www.ncbi.nlm.nih.gov/pmc/articles/PMC8404831/
30099,"Immune response to SARS-CoV-2 variants: A focus on severity, susceptibility, and preexisting immunity",https://www.ncbi.nlm.nih.gov/pmc/articles/PMC8757655/
30100,Immunogenic and reactogenic efficacy of Covaxin and Covishield: a comparative review,https://www.ncbi.nlm.nih.gov/pmc/articles/PMC8861611/
30101,Microglia Fighting for Neurological and Mental Health: On the Central Nervous System Frontline of COVID-19 Pandemic,https://www.ncbi.nlm.nih.gov/pmc/articles/PMC7961561/
30102,Epidemiological and clinical characteristics of pregnant women and neonates with COVID‐19 in Northwest Mexico,https://www.ncbi.nlm.nih.gov/pmc/articles/PMC9348056/
30103,"The COVID-19 pandemic, an environmental neurology perspective",https://www.ncbi.nlm.nih.gov/pmc/articles/PMC8938187/
30104,Long COVID or Post-acute Sequelae of COVID-19 (PASC): An Overview of Biological Factors That May Contribute to Persistent Symptoms,https://www.ncbi.nlm.nih.gov/pmc/articles/PMC8260991/
30105,"Inflammation at the crossroads of COVID-19, cognitive deficits and depression",https://www.ncbi.nlm.nih.gov/pmc/articles/PMC8894741/
30106,"Morphological and functional findings in COVID-19 lung disease as compared to Pneumonia, ARDS, and High-Altitude Pulmonary Edema",https://www.ncbi.nlm.nih.gov/pmc/articles/PMC9707029/
30107,Hyperimmune immunoglobulin for people with COVID‐19,https://www.ncbi.nlm.nih.gov/pmc/articles/PMC9887673/
30108,Superior possibilities and upcoming horizons for nanoscience in COVID-19: noteworthy approach for effective diagnostics and management of SARS-CoV-2 outbreak,https://www.ncbi.nlm.nih.gov/pmc/articles/PMC10072050/
30109,Complications of COVID-19 on the Central Nervous System: Mechanisms and Potential Treatment for Easing Long COVID,https://www.ncbi.nlm.nih.gov/pmc/articles/PMC10529748/
30110,Targeting the SphK-S1P-SIPR Pathway as a Potential Therapeutic Approach for COVID-19,https://www.ncbi.nlm.nih.gov/pmc/articles/PMC7583882/
30111,Renal consequences of the novel coronavirus disease 2019 (COVID-19) and hydrogen sulfide as a potential therapy,https://www.ncbi.nlm.nih.gov/pmc/articles/PMC8755416/
30112,The Rise of SARS-CoV-2 Variants and the Role of Convalescent Plasma Therapy for Management of Infections,https://www.ncbi.nlm.nih.gov/pmc/articles/PMC8399171/
30113,"COVID-19 Pandemic: Advances in Diagnosis, Treatment, Organoid Applications and Impacts on Cancer Patient Management",https://www.ncbi.nlm.nih.gov/pmc/articles/PMC8039300/
30114,"A review of SARS-CoV-2 variants and vaccines: Viral properties, mutations, vaccine efficacy, and safety",https://www.ncbi.nlm.nih.gov/pmc/articles/PMC10774670/
30115,A comprehensive review on efficient approaches for combating coronaviruses,https://www.ncbi.nlm.nih.gov/pmc/articles/PMC8531103/
30116,Spectrum of COVID-19 induced liver injury: A review report,https://www.ncbi.nlm.nih.gov/pmc/articles/PMC11056898/
30117,High-Density Blood Transcriptomics Reveals Precision Immune Signatures of SARS-CoV-2 Infection in Hospitalized Individuals,https://www.ncbi.nlm.nih.gov/pmc/articles/PMC8322982/
30118,COVID-19 and diabetes: Association intensify risk factors for morbidity and mortality,https://www.ncbi.nlm.nih.gov/pmc/articles/PMC9080053/
30119,Liver damage in the context of SARS-CoV-2. Covid-19 treatment and its effects on the liver,https://www.ncbi.nlm.nih.gov/pmc/articles/PMC9321495/
30120,Respiratory psychophysiology and COVID-19: A research agenda,https://www.ncbi.nlm.nih.gov/pmc/articles/PMC9756651/
30121,Imatinib and methazolamide ameliorate COVID-19-induced metabolic complications via elevating ACE2 enzymatic activity and inhibiting viral entry,https://www.ncbi.nlm.nih.gov/pmc/articles/PMC8832557/
30122,The COVID-19 pandemic: diverse contexts; different epidemics—how and why?,https://www.ncbi.nlm.nih.gov/pmc/articles/PMC7392634/
30123,How COVID-19 shaped mental health: from infection to pandemic effects,https://www.ncbi.nlm.nih.gov/pmc/articles/PMC9711928/
30124,"Regulatory T Cells (Tregs) and COVID-19: Unveiling the Mechanisms, and Therapeutic Potentialities with a Special Focus on Long COVID",https://www.ncbi.nlm.nih.gov/pmc/articles/PMC10059134/
30125,"A Multi-Center Study Investigating Long COVID-19 in Healthcare Workers from North-Eastern Italy: Prevalence, Risk Factors and the Impact of Pre-Existing Humoral Immunity—ORCHESTRA Project",https://www.ncbi.nlm.nih.gov/pmc/articles/PMC10747427/
30126,Depressive and Neurocognitive Disorders in the Context of the Inflammatory Background of COVID-19,https://www.ncbi.nlm.nih.gov/pmc/articles/PMC8541562/
30127,"Integrated Metabolic and Inflammatory Signatures Associated with Severity of, Fatality of, and Recovery from COVID-19",https://www.ncbi.nlm.nih.gov/pmc/articles/PMC10100880/
30128,Analysis of transcriptomic responses to SARS-CoV-2 reveals plausible defective pathways responsible for increased susceptibility to infection and complications and helps to develop fast-track repositioning of drugs against COVID-19,https://www.ncbi.nlm.nih.gov/pmc/articles/PMC9423878/
30129,"Promising natural products against SARS‐CoV‐2: Structure, function, and clinical trials",https://www.ncbi.nlm.nih.gov/pmc/articles/PMC9538226/
30130,Convalescent plasma therapy against the emerging SARS-CoV-2 variants: Delineation of the potentialities and risks,https://www.ncbi.nlm.nih.gov/pmc/articles/PMC8717699/
30131,Hyperactivation of P2X7 receptors as a culprit of COVID-19 neuropathology,https://www.ncbi.nlm.nih.gov/pmc/articles/PMC7738776/
30132,"The Relationship between Mental Disorders and the COVID-19 Pandemic—Course, Risk Factors, and Potential Consequences",https://www.ncbi.nlm.nih.gov/pmc/articles/PMC9368061/
30133,State-of-art high-performance Nano-systems for mutated coronavirus infection management: From Lab to Clinic,https://www.ncbi.nlm.nih.gov/pmc/articles/PMC9463543/
30134,Targeting neutrophils extracellular traps (NETs) reduces multiple organ injury in a COVID-19 mouse model,https://www.ncbi.nlm.nih.gov/pmc/articles/PMC9978286/
30135,"A systemic review on liquid crystals, nanoformulations and its application for detection and treatment of SARS – CoV- 2 (COVID – 19)",https://www.ncbi.nlm.nih.gov/pmc/articles/PMC9265145/
30136,Herbal immune-boosters: Substantial warriors of pandemic Covid-19 battle,https://www.ncbi.nlm.nih.gov/pmc/articles/PMC7532351/
30137,"Aging & COVID-19 susceptibility, disease severity, and clinical outcomes: The role of entangled risk factors",https://www.ncbi.nlm.nih.gov/pmc/articles/PMC8329427/
30138,Interactions of SARS-CoV-2 with the Blood–Brain Barrier,https://www.ncbi.nlm.nih.gov/pmc/articles/PMC7961671/
30139,A review of cytokine-based pathophysiology of Long COVID symptoms,https://www.ncbi.nlm.nih.gov/pmc/articles/PMC10103649/
30140,"Drug repurposing for COVID-19: Approaches, challenges and promising candidates",https://www.ncbi.nlm.nih.gov/pmc/articles/PMC8220862/
30141,Potential relationships between COVID-19 and the thyroid gland: an update,https://www.ncbi.nlm.nih.gov/pmc/articles/PMC8894980/
30142,SARS-CoV-2/COVID-19: a primer for cardiologists,https://www.ncbi.nlm.nih.gov/pmc/articles/PMC7360901/
30143,"High SARS-CoV-2 seroprevalence in Karaganda, Kazakhstan before the launch of COVID-19 vaccination",https://www.ncbi.nlm.nih.gov/pmc/articles/PMC9328563/
30144,Diabetes as one of the long-term COVID-19 complications: from the potential reason of more diabetic patients’ susceptibility to COVID-19 to the possible caution of future global diabetes tsunami,https://www.ncbi.nlm.nih.gov/pmc/articles/PMC10116486/
30145,Cholinergic dysfunction in COVID-19: frantic search and hoping for the best,https://www.ncbi.nlm.nih.gov/pmc/articles/PMC9735034/
30146,SARS-CoV-2 interacts with renin-angiotensin system: impact on the central nervous system in elderly patients,https://www.ncbi.nlm.nih.gov/pmc/articles/PMC8853071/
30147,Spatial transcriptomic characterization of COVID-19 pneumonitis identifies immune circuits related to tissue injury,https://www.ncbi.nlm.nih.gov/pmc/articles/PMC9977306/
30148,Catching a resurgence: Increase in SARS-CoV-2 viral RNA identified in wastewater 48 h before COVID-19 clinical tests and 96 h before hospitalizations,https://www.ncbi.nlm.nih.gov/pmc/articles/PMC7826013/
30149,The SARS-CoV-2 viral load in COVID-19 patients is lower on face mask filters than on nasopharyngeal swabs,https://www.ncbi.nlm.nih.gov/pmc/articles/PMC8242000/
30150,Omicron variant: Current insights and future directions,https://www.ncbi.nlm.nih.gov/pmc/articles/PMC9482093/
30151,SARS-CoV-2: Emerging Role in the Pathogenesis of Various Thyroid Diseases,https://www.ncbi.nlm.nih.gov/pmc/articles/PMC8628126/
30152,COVID-19 patient transcriptomic and genomic profiling reveals comorbidity interactions with psychiatric disorders,https://www.ncbi.nlm.nih.gov/pmc/articles/PMC7957287/
30153,Review of therapeutic mechanisms and applications based on SARS-CoV-2 neutralizing antibodies,https://www.ncbi.nlm.nih.gov/pmc/articles/PMC10060843/
30154,Evolution of the newest diagnostic methods for COVID-19: a Chinese perspective,https://www.ncbi.nlm.nih.gov/pmc/articles/PMC10264177/
30155,Neutralizing monoclonal antibodies for treatment of COVID-19,https://www.ncbi.nlm.nih.gov/pmc/articles/PMC8054133/
30156,Long-term outcomes of pediatric infections: from traditional infectious diseases to long covid,https://www.ncbi.nlm.nih.gov/pmc/articles/PMC8910780/
30157,Biobehavioral Implications of Covid-19 for Transplantation and Cellular Therapy Recipients,https://www.ncbi.nlm.nih.gov/pmc/articles/PMC9295749/
30158,Natural Bioactive Molecules: An Alternative Approach to the Treatment and Control of COVID-19,https://www.ncbi.nlm.nih.gov/pmc/articles/PMC8658031/
30159,The SARS-CoV-2 mutations versus vaccine effectiveness: New opportunities to new challenges,https://www.ncbi.nlm.nih.gov/pmc/articles/PMC8730674/
30160,Impact of the COVID-19 pandemic on sick leave among healthcare workers: a register-based observational study,https://www.ncbi.nlm.nih.gov/pmc/articles/PMC10314089/
30161,Effectiveness of COVID-19 Convalescent Plasma (CCP) During the Pandemic Era: A Literature Review,https://www.ncbi.nlm.nih.gov/pmc/articles/PMC9968437/
30162,Involvement of epigenetics in affecting host immunity during SARS-CoV-2 infection,https://www.ncbi.nlm.nih.gov/pmc/articles/PMC9790847/
