Id,Title,Link
33655,Targeting SARS-CoV-2 Polymerase with New Nucleoside Analogues,https://www.ncbi.nlm.nih.gov/pmc/articles/PMC8201013/
33656,The ecological consequences of a pandemic,https://www.ncbi.nlm.nih.gov/pmc/articles/PMC7728681/
33657,"Flattening the curve of COVID-19 for medical education in psychiatry and
addiction medicine",https://www.ncbi.nlm.nih.gov/pmc/articles/PMC7424613/
33658,Establishment of Neural Series Transmission Keys (NSTKs) and Security in the Field of COVID-19 Telepediatric Oral Health,https://www.ncbi.nlm.nih.gov/pmc/articles/PMC10016166/
33659,“It was really poor prior to the pandemic. It got really bad after”: A qualitative study of the impact of COVID-19 on prison healthcare in England,https://www.ncbi.nlm.nih.gov/pmc/articles/PMC9903265/
33660,VR Sickness Adaptation With Ramped Optic Flow Transfers From Abstract To Realistic Environments,https://www.ncbi.nlm.nih.gov/pmc/articles/PMC9979719/
33661,Occupant health in buildings: Impact of the COVID-19 pandemic on the opinions of building professionals and implications on research,https://www.ncbi.nlm.nih.gov/pmc/articles/PMC8520175/
33662,A Short 5′triphosphate RNA nCoV-L Induces a Broad-Spectrum Antiviral Response by Activating RIG-I,https://www.ncbi.nlm.nih.gov/pmc/articles/PMC9694983/
33663,COVID‐19: Evolving challenges and opportunities for residential and vocational intellectual disability service providers,https://www.ncbi.nlm.nih.gov/pmc/articles/PMC9115148/
33664,Autoimmune Polyendocrinopathy in a Pediatric Patient Presenting With Multisystem Inflammatory Syndrome in Children (MIS-C),https://www.ncbi.nlm.nih.gov/pmc/articles/PMC10232015/
33665,"Clinical placements for undergraduate diagnostic radiography students amidst the COVID-19 pandemic in Singapore: Preparation, challenges and strategies for safe resumption",https://www.ncbi.nlm.nih.gov/pmc/articles/PMC7434406/
33666,SARS-CoV-2 updates in a West African population and precautionary measures for sustaining quality antenatal care delivery,https://www.ncbi.nlm.nih.gov/pmc/articles/PMC7567409/
33667,Implementation of smart social distancing for COVID-19 based on deep learning algorithm,https://www.ncbi.nlm.nih.gov/pmc/articles/PMC9019287/
33668,Mothers’ Access to Social and Health Care Systems Support during Their Infants’ First Year during the COVID-19 Pandemic: A Qualitative Feminist Poststructural Study,https://www.ncbi.nlm.nih.gov/pmc/articles/PMC10057522/
33669,The “Labeled” Side of COVID-19 in India: Psychosocial Perspectives on Islamophobia During the Pandemic,https://www.ncbi.nlm.nih.gov/pmc/articles/PMC7862115/
33670,"Best Practice Recommendations for the Diagnosis and Management of Children With Pediatric Inflammatory Multisystem Syndrome Temporally Associated With SARS-CoV-2 (PIMS-TS; Multisystem Inflammatory Syndrome in Children, MIS-C) in Switzerland",https://www.ncbi.nlm.nih.gov/pmc/articles/PMC8187755/
33671,Sickness absence among 299484 blue-collar workers in the trade industry during the Covid-19 pandemic: Kristin Farrants,https://www.ncbi.nlm.nih.gov/pmc/articles/PMC9594747/
33672,Monetary quantification of COVID-19 impacts on sustainable development goals: Focus on air pollution and climate change,https://www.ncbi.nlm.nih.gov/pmc/articles/PMC9335064/
33673,Labor market effects of COVID‐19 in Sweden and its neighbors: Evidence from administrative data,https://www.ncbi.nlm.nih.gov/pmc/articles/PMC8661996/
33674,Lockdown measures and their impact on single- and two-age-structured epidemic model for the COVID-19 outbreak in Mexico,https://www.ncbi.nlm.nih.gov/pmc/articles/PMC7997978/
33675,"Monoclonal antibodies for prophylaxis and therapy of respiratory syncytial virus, SARS-CoV-2, human immunodeficiency virus, rabies and bacterial infections: an update from the World Association of Infectious Diseases and Immunological Disorders and the Italian Society of Antinfective Therapy",https://www.ncbi.nlm.nih.gov/pmc/articles/PMC10226646/
33676,“ECT should never stop”: Exploring the experiences and recommendations of ECT clinical directors and anesthetists about ECT during the COVID-19 pandemic,https://www.ncbi.nlm.nih.gov/pmc/articles/PMC9516326/
33677,Recent advances in the nucleic acid-based diagnostic tool for coronavirus,https://www.ncbi.nlm.nih.gov/pmc/articles/PMC7538041/
33678,Association of systemic adverse reaction patterns with long-term dynamics of humoral and cellular immunity after coronavirus disease 2019 third vaccination,https://www.ncbi.nlm.nih.gov/pmc/articles/PMC10246541/
33679,Assessing sickness behavior in the French: Validation of the French translation of the sickness questionnaire (SicknessQ) in a non-clinical French population,https://www.ncbi.nlm.nih.gov/pmc/articles/PMC10695833/
33680,"Is Smart Working Beneficial for Workers’ Wellbeing? A Longitudinal Investigation of Smart Working, Workload, and Hair Cortisol/Dehydroepiandrosterone Sulfate during the COVID-19 Pandemic",https://www.ncbi.nlm.nih.gov/pmc/articles/PMC10341102/
33681,"Prevention and Treatment of “Epidemic Toxin, Pathogenic Dampness, and Lung Deficiency” after COVID-19 Recovery Based on the Theory of “Preventive Treatment of Diseases” in Traditional Chinese Medicine",https://www.ncbi.nlm.nih.gov/pmc/articles/PMC9009854/
33682,Classification of COVID-19 with Belief Functions and Deep Neural Network,https://www.ncbi.nlm.nih.gov/pmc/articles/PMC9870200/
33683,Coping With COVID-19: The Benefits of Anticipating Future Positive Events and Maintaining Optimism,https://www.ncbi.nlm.nih.gov/pmc/articles/PMC8062780/
33684,The effect of the Covid-19 pandemic on STEM faculty: Productivity and work-life balance,https://www.ncbi.nlm.nih.gov/pmc/articles/PMC9882624/
33685,COVID‐19 and Religious Ethics,https://www.ncbi.nlm.nih.gov/pmc/articles/PMC7436539/
33686,Modeling epidemic recovery: An expert elicitation on issues and approaches,https://www.ncbi.nlm.nih.gov/pmc/articles/PMC8574926/
33687,Acute Myocarditis and Heart Failure Associated with Multisystem Inflammatory Syndrome in Adults: A Rare Sequela of Coronavirus 2 Infection,https://www.ncbi.nlm.nih.gov/pmc/articles/PMC9721183/
33688,Influence of COVID-19 confinement measures on appendectomies in Germany—a claims data analysis of 9797 patients,https://www.ncbi.nlm.nih.gov/pmc/articles/PMC7717103/
33689,Interplay of host and viral factors in inflammatory pathway mediated cytokine storm during RNA virus infection,https://www.ncbi.nlm.nih.gov/pmc/articles/PMC10238879/
33690,The economic impact of a COVID-19 illness from the perspective of families seeking care in a private hospital in India,https://www.ncbi.nlm.nih.gov/pmc/articles/PMC10208655/
33691,A computational study of potential therapeutics for COVID-19 invoking conceptual density functional theory,https://www.ncbi.nlm.nih.gov/pmc/articles/PMC9452875/
33692,Chronic post-COVID-19 syndrome and chronic fatigue syndrome: Is there a role for extracorporeal apheresis?,https://www.ncbi.nlm.nih.gov/pmc/articles/PMC8209771/
33693,Toward Using Twitter Data to Monitor COVID-19 Vaccine Safety in Pregnancy: Proof-of-Concept Study of Cohort Identification,https://www.ncbi.nlm.nih.gov/pmc/articles/PMC8734607/
33694,Expert Consensus on the Resource Needs of Autistic Children and Young People in Ireland During the Early Months of the COVID-19 Pandemic,https://www.ncbi.nlm.nih.gov/pmc/articles/PMC10038695/
33695,Ethnic and socioeconomic differences in SARS-CoV-2 infection: prospective cohort study using UK Biobank,https://www.ncbi.nlm.nih.gov/pmc/articles/PMC7255908/
33696,Intractable airsickness associated with COVID-19: A case report,https://www.ncbi.nlm.nih.gov/pmc/articles/PMC7688289/
33697,"“As long as that place stays open, I’ll stay alive”: Accessing injectable opioid agonist treatment during dual public health crises",https://www.ncbi.nlm.nih.gov/pmc/articles/PMC10104430/
33698,Immunological Mechanisms of Sickness Behavior in Viral Infection,https://www.ncbi.nlm.nih.gov/pmc/articles/PMC8624889/
33699,Healthcare workers and protection against inhalable SARS-CoV-2 aerosols,https://www.ncbi.nlm.nih.gov/pmc/articles/PMC7989185/
33700,A cross-sectional study exploring community perspectives on the impacts of COVID-19 in Nunavut and recommendations for a Holistic Inuit Qaujimajatuqangit approach to emergency response,https://www.ncbi.nlm.nih.gov/pmc/articles/PMC11005875/
33701,Covid‐19 vaccination uptake by Hapū Māmā – How are we progressing?,https://www.ncbi.nlm.nih.gov/pmc/articles/PMC9538956/
33702,"Path Model Analysis of the Effects of Perceived Formalism, and Fear of COVID-19 on Police Officers’ PTSD and Insomnia",https://www.ncbi.nlm.nih.gov/pmc/articles/PMC10604008/
33703,Determinants of Influenza Vaccination Coverage among Greek Health Care Workers amid COVID-19 Pandemic,https://www.ncbi.nlm.nih.gov/pmc/articles/PMC8482201/
33704,Anxiety in the face of the first wave of the spread of COVID-19 in Israel: Psychosocial determinants of a “Panic-to-complacency-continuum”,https://www.ncbi.nlm.nih.gov/pmc/articles/PMC9719843/
33705,Food security and Canada's agricultural system challenged by COVID‐19,https://www.ncbi.nlm.nih.gov/pmc/articles/PMC7264657/
33706,"“Alexa, Am I pregnant?”: A content analysis of a virtual assistant’s responses to prenatal health questions during the COVID-19 pandemic",https://www.ncbi.nlm.nih.gov/pmc/articles/PMC7771908/
33707,"Coping, health anxiety, and stress among health professionals during Covid-19, Cape Coast, Ghana",https://www.ncbi.nlm.nih.gov/pmc/articles/PMC10824413/
33708,Impact of COVID-19 Pandemic on Post-Graduate Medical Education and Training in India: Lessons Learned and Opportunities Offered,https://www.ncbi.nlm.nih.gov/pmc/articles/PMC8325012/
33709,Hypertension is still a moving target in the context of COVID‐19 and post‐acute COVID‐19 syndrome,https://www.ncbi.nlm.nih.gov/pmc/articles/PMC9539041/
33710,COVID-19 and Changes in Neurosurgical Workload in the United Kingdom,https://www.ncbi.nlm.nih.gov/pmc/articles/PMC7982982/
33711,"COVID-19 and its negative impact on the mental health of health
professionals: an integrative literature review",https://www.ncbi.nlm.nih.gov/pmc/articles/PMC9444220/
33712,Blockchain: Opportunities in the healthcare sector and its uses in COVID-19,https://www.ncbi.nlm.nih.gov/pmc/articles/PMC9347291/
33713,How a Psychopharmacology Clinical Trial Site in the Seattle Area Managed Clinical Trials and Patient Care During the COVID-19 Pandemic,https://www.ncbi.nlm.nih.gov/pmc/articles/PMC7299855/
33714,Intensified inequities: Young people's experiences of Covid‐19 and school closures in Uganda,https://www.ncbi.nlm.nih.gov/pmc/articles/PMC9538397/
33715,"Perceptions of education during COVID‐19 among agronomy, soil, and environmental science students",https://www.ncbi.nlm.nih.gov/pmc/articles/PMC8206661/
33716,"Qualitative perspectives on COVID-19, interpersonal violence, and interventions to improve well-being from adolescent girls and young women in Kisumu, Kenya",https://www.ncbi.nlm.nih.gov/pmc/articles/PMC10722500/
33717,Development of Moral Injury in ICU Professionals During the COVID-19 Pandemic: A Prospective Serial Interview Study,https://www.ncbi.nlm.nih.gov/pmc/articles/PMC9847689/
33718,Impact of the COVID-19 pandemic on interventional radiology services across the world,https://www.ncbi.nlm.nih.gov/pmc/articles/PMC8133525/
33719,A hospital demand and capacity intervention approach for COVID-19,https://www.ncbi.nlm.nih.gov/pmc/articles/PMC10156009/
33720,Breaking Bad: Inflammasome Activation by Respiratory Viruses,https://www.ncbi.nlm.nih.gov/pmc/articles/PMC10376673/
33721,Healthcare worker acute respiratory illness cluster in 2020: Could it be from COVID-19?,https://www.ncbi.nlm.nih.gov/pmc/articles/PMC7411436/
33722,The impact of policy timing on the spread of COVID-19,https://www.ncbi.nlm.nih.gov/pmc/articles/PMC8324487/
33723,"Predictive analysis, diagnosis of COVID-19 through computational screening and validation with spectro photometrical approach",https://www.ncbi.nlm.nih.gov/pmc/articles/PMC10112302/
33724,Mental health of healthcare professionals during the ongoing COVID-19 pandemic: a comparative investigation from the first and second pandemic years,https://www.ncbi.nlm.nih.gov/pmc/articles/PMC10039975/
33725,Demand and motivation for influenza vaccination among healthcare workers before and during the COVID-19 era: a cross-sectional survey,https://www.ncbi.nlm.nih.gov/pmc/articles/PMC8381842/
33726,Psychometric properties of the Illness Attitude Toward COVID‐19 Scale (IATCS),https://www.ncbi.nlm.nih.gov/pmc/articles/PMC8250579/
33727,Effects of Hyperbaric Oxygen Therapy on Long COVID: A Systematic Review,https://www.ncbi.nlm.nih.gov/pmc/articles/PMC11051078/
33728,Vaccine-hesitant people misperceive the social norm of vaccination,https://www.ncbi.nlm.nih.gov/pmc/articles/PMC10165803/
33729,PNAS Nexus. 2023 Jul; 2(7): pgad218. ,https://www.ncbi.nlm.nih.gov/pmc/articles/PMC10319613/
33730,PNAS Nexus. 2023 Nov; 2(11): pgad366. ,https://www.ncbi.nlm.nih.gov/pmc/articles/PMC10650275/
33731,Deferral of elective surgeries during the COVID-19 pandemic and its impact on Palestinian patients: a cross-sectional study,https://www.ncbi.nlm.nih.gov/pmc/articles/PMC10037382/
33732,Impact of COVID-19 – Experiences of 5th year medical students at the University of KwaZulu-Natal,https://www.ncbi.nlm.nih.gov/pmc/articles/PMC9257683/
33733,Benefit of an action camera in endoscopy education for medical students under COVID-19,https://www.ncbi.nlm.nih.gov/pmc/articles/PMC10517461/
33734,Profiles of subjective well-being among people living with HIV during the COVID-19 pandemic,https://www.ncbi.nlm.nih.gov/pmc/articles/PMC10624723/
33735,Masked face is looking at me: Face mask increases the feeling of being looked at during the COVID-19 pandemic,https://www.ncbi.nlm.nih.gov/pmc/articles/PMC9730803/
33736,Microbleed patterns in critical illness and COVID-19,https://www.ncbi.nlm.nih.gov/pmc/articles/PMC7939996/
33737,Neuromuscular defects after infection with a beta coronavirus in mice,https://www.ncbi.nlm.nih.gov/pmc/articles/PMC10281698/
33738,"Factors contributing to the distress, concerns, and needs of UK Neuroscience health care workers during the COVID‐19 pandemic",https://www.ncbi.nlm.nih.gov/pmc/articles/PMC7404511/
33739,Vestibular migraine: a manifestation of long COVID syndrome in children,https://www.ncbi.nlm.nih.gov/pmc/articles/PMC10230938/
33740,Genomic characterization of a novel SARS-CoV-2,https://www.ncbi.nlm.nih.gov/pmc/articles/PMC7161481/
33741,"Can digital health researchers make a difference during the pandemic? Results of the single-arm, chatbot-led Elena+: Care for COVID-19 interventional study",https://www.ncbi.nlm.nih.gov/pmc/articles/PMC10485275/
33742,Molecular Mechanisms of Neuroinflammation in ME/CFS and Long COVID to Sustain Disease and Promote Relapses,https://www.ncbi.nlm.nih.gov/pmc/articles/PMC9174654/
33743,Using a Dynamic Causal Model to validate previous predictions and offer a 12-month forecast of the long-term effects of the COVID-19 epidemic in the UK,https://www.ncbi.nlm.nih.gov/pmc/articles/PMC9853371/
33744,Crises as Catalyst: A New Social Contract Grounded in Worker Rights,https://www.ncbi.nlm.nih.gov/pmc/articles/PMC8694294/
33745,Effects of Employee Sickness Presence on Customer Repurchase and Recommendation Intentions: The Role of Customer Affective Reactions,https://www.ncbi.nlm.nih.gov/pmc/articles/PMC8366743/
33746,The Enabling Role of ICT to Mitigate the Negative Effects of Emotional and Social Loneliness of the Elderly during COVID-19 Pandemic,https://www.ncbi.nlm.nih.gov/pmc/articles/PMC8068368/
33747,"Genes, inflammatory response, tolerance, and resistance to virus infections in migratory birds, bats, and rodents",https://www.ncbi.nlm.nih.gov/pmc/articles/PMC10497949/
33748,Analysis of the Return to Work Program for Disabled Workers during the Pandemic COVID-19 Using the Quality of Life and Work Ability Index: Cross-Sectional Study,https://www.ncbi.nlm.nih.gov/pmc/articles/PMC9958840/
33749,Exploring New Mechanism of Depression from the Effects of Virus on Nerve Cells,https://www.ncbi.nlm.nih.gov/pmc/articles/PMC10340315/
33750,Into the “New Normal”: The Ethical and Analytical Challenge Facing Public Health Post-COVID-19,https://www.ncbi.nlm.nih.gov/pmc/articles/PMC9316285/
33751,"Keeping the Faith: Religion, Positive Coping, and Mental Health of Caregivers During COVID-19",https://www.ncbi.nlm.nih.gov/pmc/articles/PMC8811163/
33752,Variations in classroom ventilation during the COVID-19 pandemic: Insights from monitoring 36 naturally ventilated classrooms in the UK during 2021,https://www.ncbi.nlm.nih.gov/pmc/articles/PMC9664748/
33753,Social distancing and reopening universities after the COVID-19 pandemic: policy complexity in G20 countries,https://www.ncbi.nlm.nih.gov/pmc/articles/PMC7868772/
33754,Professional Social Media Usage and Work Engagement Among Professionals in Finland Before and During the COVID-19 Pandemic: Four-Wave Follow-Up Study,https://www.ncbi.nlm.nih.gov/pmc/articles/PMC8208471/
33755,History and Recent Advances of the Japanese Society of Biofeedback Research,https://www.ncbi.nlm.nih.gov/pmc/articles/PMC8214059/
33756,Working from Home During Covid-19 Pandemic and Changes to Fertility Intentions Among Parents,https://www.ncbi.nlm.nih.gov/pmc/articles/PMC10581933/
33757,Face Covered and Six Feet Apart: Behavioral Awareness Predicts Greater Adherence to Public Health Guidelines during the COVID-19 Pandemic,https://www.ncbi.nlm.nih.gov/pmc/articles/PMC8393471/
33758,Estimating the burden of United States workers exposed to infection or disease: A key factor in containing risk of COVID-19 infection,https://www.ncbi.nlm.nih.gov/pmc/articles/PMC7188235/
33759,The Impact of Career Plateau on Job Burnout in the COVID-19 Pandemic: A Moderating Role of Regulatory Focus,https://www.ncbi.nlm.nih.gov/pmc/articles/PMC8834611/
33760,A nurse is a gift to older parents with COVID-19: One nurse's story,https://www.ncbi.nlm.nih.gov/pmc/articles/PMC8500207/
33761,Nutrition care processes across hospitalisation in critically ill patients with COVID-19 in Australia: A multicentre prospective observational study,https://www.ncbi.nlm.nih.gov/pmc/articles/PMC9842626/
33762,In silico analyses of major active constituents of fingerroot (Boesenbergia rotunda) unveils inhibitory activities against SARS-CoV-2 main protease enzyme,https://www.ncbi.nlm.nih.gov/pmc/articles/PMC8620019/
33763,Immunogenicity and safety of BNT162b2 mRNA COVID-19 vaccine in a subject affected by Shapiro’s syndrome: A case report,https://www.ncbi.nlm.nih.gov/pmc/articles/PMC9746352/
33764,"Efficacy of Generalized Face 
Masking Mandates",https://www.ncbi.nlm.nih.gov/pmc/articles/PMC8586184/
33765,Perceived Risk of Job Instability and Unethical Organizational Behaviour Amid the COVID-19 Pandemic: The Role of Family Financial Pressure and Distributive Injustice in the Tourism Industry,https://www.ncbi.nlm.nih.gov/pmc/articles/PMC8910637/
33766,Rates of SARS-CoV-2 transmission and vaccination impact the fate of vaccine-resistant strains,https://www.ncbi.nlm.nih.gov/pmc/articles/PMC8324827/
33767,Psychosocial perception of health-care workers in a COVID-19-designated hospital in eastern India,https://www.ncbi.nlm.nih.gov/pmc/articles/PMC8893095/
33768,"Global Outbreak Alert and Response Network deployments during the COVID-19 pandemic, WHO Western Pacific Region",https://www.ncbi.nlm.nih.gov/pmc/articles/PMC10948340/
33769,Efficacy of simplified-cognitive behavioral therapy for insomnia(S-CBTI) among female COVID-19 patients with insomnia symptom in Wuhan mobile cabin hospital,https://www.ncbi.nlm.nih.gov/pmc/articles/PMC7985232/
33770,Healthcare Access in Medically Underserved Areas During the COVID-19 Era: An International Medical Graduate Perspective From a Rural State,https://www.ncbi.nlm.nih.gov/pmc/articles/PMC7767844/
33771,Resources or trust: What matters more in the vaccination strategies of high-income liberal democracies?,https://www.ncbi.nlm.nih.gov/pmc/articles/PMC8956345/
33772,Post-COVID Multisystem Inflammatory Syndrome-Adult Leading to Cardiomyopathy and Autoimmune Thyroiditis: A Case Report,https://www.ncbi.nlm.nih.gov/pmc/articles/PMC9922567/
33773,The impact of COVID-19 on Children’s Social Care in England,https://www.ncbi.nlm.nih.gov/pmc/articles/PMC7494292/
33774,The COVID-19 Pandemic Strain: Teleworking and Health Behavior Changes in the Portuguese Context,https://www.ncbi.nlm.nih.gov/pmc/articles/PMC8468513/
33775,Experience with the safe admission of breast and thyroid cancer patients in non-endemic areas during an epidemic outbreak,https://www.ncbi.nlm.nih.gov/pmc/articles/PMC10534036/
33776,Asymptomatic COVID-19 patients and possible screening before an emergency aerosol related endodontic protocols in dental clinic-A Review,https://www.ncbi.nlm.nih.gov/pmc/articles/PMC7652188/
33777,"On race and ethnicity during a global pandemic: An ‘imperfect mosaic’ of maternal and child health services in ethnically-diverse South London, United Kingdom",https://www.ncbi.nlm.nih.gov/pmc/articles/PMC9249549/
33778,Season Suspension and Summer Extension: Unique Opportunity for Professional Team-Sport Athletes and Support Staff During and Following the COVID-19 Crisis,https://www.ncbi.nlm.nih.gov/pmc/articles/PMC7739718/
33779,THE ZOONOTIC CITY: Urban Political Ecology and the Pandemic Imaginary,https://www.ncbi.nlm.nih.gov/pmc/articles/PMC9299822/
33780,Much Needed Medicine: A Qualitative Study of Hawai‘i Resident Views During COVID-19,https://www.ncbi.nlm.nih.gov/pmc/articles/PMC8538116/
33781,Prognostic accuracy of eight triage scores in suspected COVID-19 in an Emergency Department low-income setting: An observational cohort study,https://www.ncbi.nlm.nih.gov/pmc/articles/PMC10839866/
33782,Characteristics of patients undergoing hemodialysis during Covid-19 pandemic,https://www.ncbi.nlm.nih.gov/pmc/articles/PMC8600944/
33783,High-performance association rule mining: Mortality prediction model for cardiovascular patients with COVID-19 patterns,https://www.ncbi.nlm.nih.gov/pmc/articles/PMC10043740/
33784,Disaster Extractivism: Latin America’s Extractive Shock Therapy in the Age of COVID-19,https://www.ncbi.nlm.nih.gov/pmc/articles/PMC10345397/
33785,Occupational stress and burnout among intensive care unit nurses during the pandemic: A prospective longitudinal study of nurses in COVID and non-COVID units,https://www.ncbi.nlm.nih.gov/pmc/articles/PMC10040835/
33786,The COVID-19 pandemic: how to maintain a healthy immune system during the lockdown – a multidisciplinary approach with special focus on athletes,https://www.ncbi.nlm.nih.gov/pmc/articles/PMC7433333/
33787,"Semi-Synthesis of N-Aryl Amide Analogs of Piperine from Piper nigrum and Evaluation of Their Antitrypanosomal, Antimalarial, and Anti-SARS-CoV-2 Main Protease Activities",https://www.ncbi.nlm.nih.gov/pmc/articles/PMC9100884/
33788,NHS staff mental health status in the active phase of the COVID-19 era: a staff survey in a large London hospital,https://www.ncbi.nlm.nih.gov/pmc/articles/PMC7987534/
33789,Viral Heroism: What the Rhetoric of Heroes in the COVID-19 Pandemic Tells Us About Medicine and Professional Identity,https://www.ncbi.nlm.nih.gov/pmc/articles/PMC7867860/
33790,Ischemic stroke in the setting of supratherapeutic International Normalized Ratio following coronavirus disease 2019 infection: a case report,https://www.ncbi.nlm.nih.gov/pmc/articles/PMC10229219/
33791,"Covid-19 and workers’ protection: lessons to learn, and lessons overlooked",https://www.ncbi.nlm.nih.gov/pmc/articles/PMC7989182/
33792,Rituximab for the treatment of multiple sclerosis: a review,https://www.ncbi.nlm.nih.gov/pmc/articles/PMC7790722/
33793,COVID-19 Patient Count Prediction Using LSTM,https://www.ncbi.nlm.nih.gov/pmc/articles/PMC8545011/
33794,An extremely rare mucocutaneous adverse reaction following COVID‐19 vaccination: Toxic epidermal necrolysis,https://www.ncbi.nlm.nih.gov/pmc/articles/PMC9111664/
33795,"An observation of the impact of CoViD-19 recommendation measures monitored through urban noise levels in central Stockholm, Sweden",https://www.ncbi.nlm.nih.gov/pmc/articles/PMC7470738/
33796,SARS-CoV-2 and EBV; the cost of a second mitochondrial “whammy”?,https://www.ncbi.nlm.nih.gov/pmc/articles/PMC8556816/
33797,Humans can detect axillary odor cues of an acute respiratory infection in others,https://www.ncbi.nlm.nih.gov/pmc/articles/PMC10324639/
33798,Coping with drug resistant tuberculosis alongside COVID-19 and other stressors in Zimbabwe: A qualitative study,https://www.ncbi.nlm.nih.gov/pmc/articles/PMC10406177/
33799,Understanding the Needs and Priorities of People Living with Persistent Pain and Long-Term Musculoskeletal Conditions during the COVID-19 Pandemic—A Public Involvement Project,https://www.ncbi.nlm.nih.gov/pmc/articles/PMC9222303/
33800,Serving the public? A content analysis of COVID-19 public service announcements airing from March – December of 2020 in the U.S,https://www.ncbi.nlm.nih.gov/pmc/articles/PMC9444310/
33801,SARS-CoV-2 main protease targeting potent fluorescent inhibitors: Repurposing thioxanthones,https://www.ncbi.nlm.nih.gov/pmc/articles/PMC10388053/
33802,Effects of Different Protocols of Moderate-Intensity Intermittent Hypoxic Training on Mental Health and Quality of Life in Brazilian Adults Recovered from COVID-19: The AEROBICOVID Double-Blind Randomized Controlled Study,https://www.ncbi.nlm.nih.gov/pmc/articles/PMC10706627/
33803,Effects of the COVID-19 pandemic on secondary care for cardiovascular disease in the UK: an electronic health record analysis across three countries,https://www.ncbi.nlm.nih.gov/pmc/articles/PMC10284263/
33804,COVID Sniffer Dogs: Technical and Ethical Concerns,https://www.ncbi.nlm.nih.gov/pmc/articles/PMC8255683/
