Id,Title,Link
31258,Vulnerabilities of older adults and mitigation measures to address COVID-19 outbreak in Bangladesh: A review,https://www.ncbi.nlm.nih.gov/pmc/articles/PMC9474424/
31259,Immunomodulatory Effects of Vitamin D in Respiratory Tract Infections and COVID-19 in Children,https://www.ncbi.nlm.nih.gov/pmc/articles/PMC10421518/
31260,The pathophysiology of SARS-CoV-2: A suggested model and therapeutic approach,https://www.ncbi.nlm.nih.gov/pmc/articles/PMC7392886/
31261,Safety and effectiveness of RBD-specific polyclonal equine F(ab´)2 fragments for the treatment of hospitalized patients with severe Covid-19 disease: A retrospective cohort study,https://www.ncbi.nlm.nih.gov/pmc/articles/PMC9512184/
31262,Triaging of respiratory protective equipment on the assumed risk of SARS-CoV-2 aerosol exposure in patient-facing healthcare workers delivering secondary care: a rapid review,https://www.ncbi.nlm.nih.gov/pmc/articles/PMC7569706/
31263,"Cyanobacteria and Algae-Derived Bioactive Metabolites as Antiviral Agents: Evidence, Mode of Action, and Scope for Further Expansion; A Comprehensive Review in Light of the SARS-CoV-2 Outbreak",https://www.ncbi.nlm.nih.gov/pmc/articles/PMC8868401/
31264,The impact of leader safety communication on work engagement under pandemic: The effect of OBSE and anxiety based on COVID-19,https://www.ncbi.nlm.nih.gov/pmc/articles/PMC9972433/
31265,COV-ECGNET: COVID-19 detection using ECG trace images with deep convolutional neural network,https://www.ncbi.nlm.nih.gov/pmc/articles/PMC8785028/
31266,The Impact of Obesity and Lifestyle on the Immune System and Susceptibility to Infections Such as COVID-19,https://www.ncbi.nlm.nih.gov/pmc/articles/PMC7711810/
31267,Psychological Distress among University Staff before and during the COVID-19 Pandemic,https://www.ncbi.nlm.nih.gov/pmc/articles/PMC9915217/
31268,Clinical Presentation and Course of SARS-CoV-2 Infection in Health-Care Personnel Working in Dedicated COVID-19 Hospital During 2 Pandemic Waves in India,https://www.ncbi.nlm.nih.gov/pmc/articles/PMC8914140/
31269,Impact of COVID-19 vaccine-associated side effects on health care worker absenteeism and future booster vaccination,https://www.ncbi.nlm.nih.gov/pmc/articles/PMC9013647/
31270,"The COVID-19 Pandemic Increased Burnout and Bullying among Newly Graduated Nurses but Did Not Impact the Relationship between Burnout and Bullying and Self-Labelled Subjective Feeling of Being Bullied: A Cross-Sectional, Comparative Study",https://www.ncbi.nlm.nih.gov/pmc/articles/PMC8835049/
31271,Association between COVID-19 and Sick Leave for Healthcare Workers in a Large Academic Hospital in Southern Italy: An Observational Study,https://www.ncbi.nlm.nih.gov/pmc/articles/PMC9368056/
31272,COVID-19 vaccine hesitancy among Marshallese in Northwest Arkansas (USA),https://www.ncbi.nlm.nih.gov/pmc/articles/PMC10910884/
31273,SSRIs: Applications in inflammatory lung disease and implications for COVID‐19,https://www.ncbi.nlm.nih.gov/pmc/articles/PMC8411309/
31274,Whole genome sequencing for revealing the point mutations of SARS-CoV-2 genome in Bangladeshi isolates and their structural effects on viral proteins,https://www.ncbi.nlm.nih.gov/pmc/articles/PMC9044322/
31275,"Knowledge, Attitudes, and Perception as Predictors of COVID-19 Safety Practices of Ride-Hailing Operators in Ghana: A Cross-Sectional Study",https://www.ncbi.nlm.nih.gov/pmc/articles/PMC10001826/
31276,Perspectives of Latinx Individuals Who Were Unvaccinated And Hospitalized for COVID-19: A Qualitative Study,https://www.ncbi.nlm.nih.gov/pmc/articles/PMC9206184/
31277,JAMA Netw Open. 2022 Jul; 5(7): e2223980. ,https://www.ncbi.nlm.nih.gov/pmc/articles/PMC9277496/
31278,Assessing the effectiveness of COVID-19 vaccine lotteries: A cross-state synthetic control methods approach,https://www.ncbi.nlm.nih.gov/pmc/articles/PMC9518920/
31279,Waning immune responses against SARS-CoV-2 variants of concern among vaccinees in Hong Kong,https://www.ncbi.nlm.nih.gov/pmc/articles/PMC8893246/
31280,Impact of pandemics and disruptions to vaccination on infectious diseases epidemiology past and present,https://www.ncbi.nlm.nih.gov/pmc/articles/PMC10332206/
31281,Expert consensus on prevention and control of COVID-19 in the neurological intensive care unit (first edition),https://www.ncbi.nlm.nih.gov/pmc/articles/PMC7548511/
31282,"Neurologic adverse events among 704,003 first-dose recipients of the BNT162b2 mRNA COVID-19 vaccine in Mexico: A nationwide descriptive study",https://www.ncbi.nlm.nih.gov/pmc/articles/PMC8213977/
31283,The face behind the Covid-19 mask — A comprehensive review,https://www.ncbi.nlm.nih.gov/pmc/articles/PMC9299984/
31284,An Empirical Study on Emergency of Distant Tertiary Education in the Southern Region of Bangladesh during COVID-19: Policy Implication,https://www.ncbi.nlm.nih.gov/pmc/articles/PMC10001728/
31285,Diné (Navajo) Traditional Knowledge Holders’ Perspective of COVID-19,https://www.ncbi.nlm.nih.gov/pmc/articles/PMC9964790/
31286,Vaccine and vaccination as a part of human life: In view of COVID‐19,https://www.ncbi.nlm.nih.gov/pmc/articles/PMC8646257/
31287,Longitudinal changes in proportionate mortality due to COVID-19 by occupation in England and Wales,https://www.ncbi.nlm.nih.gov/pmc/articles/PMC10546610/
31288,Implementation of policy and management interventions to improve health and care workforce capacity to address the COVID-19 pandemic response: a systematic review,https://www.ncbi.nlm.nih.gov/pmc/articles/PMC10563305/
31289,Manifestation of Health Denialism in Attitudes toward COVID-19 Vaccination: A Qualitative Study,https://www.ncbi.nlm.nih.gov/pmc/articles/PMC10747861/
31290,Do Islanders Have a More Reactive Behavioral Immune System? Social Cognitions and Preferred Interpersonal Distances During the COVID-19 Pandemic,https://www.ncbi.nlm.nih.gov/pmc/articles/PMC8120299/
31291,The Quest for System-Theoretical Medicine in the COVID-19 Era,https://www.ncbi.nlm.nih.gov/pmc/articles/PMC8039135/
31292,COVID-19 response: mitigating negative impacts on other areas of health,https://www.ncbi.nlm.nih.gov/pmc/articles/PMC8053814/
31293,Lived experience of Jordanian front-line healthcare workers amid the COVID-19 pandemic: a qualitative study,https://www.ncbi.nlm.nih.gov/pmc/articles/PMC9344597/
31294,The burden of isolation to the individual: a comparison between isolation for COVID-19 and for other influenza-like illnesses in Japan,https://www.ncbi.nlm.nih.gov/pmc/articles/PMC8755532/
31295,Surveillance and care for confirmed and suspected patients with COVID-19 in general practice (CovidCare): study protocol for an observational trial,https://www.ncbi.nlm.nih.gov/pmc/articles/PMC8412868/
31296,Are we really all in this together? The social patterning of mortality during the first wave of the COVID-19 pandemic in Belgium,https://www.ncbi.nlm.nih.gov/pmc/articles/PMC8684273/
31297,Post-COVID syndrome: A prospective study in a tertiary hospital of Nepal,https://www.ncbi.nlm.nih.gov/pmc/articles/PMC9365179/
31298,"COVID-19 Infection in Pregnancy: Obstetrical Risk Factors and Neonatal Outcomes—A Monocentric, Single-Cohort Study",https://www.ncbi.nlm.nih.gov/pmc/articles/PMC8879809/
31299,Lung abnormalities on computed tomography of Vietnamese patients with COVID-19 and the association with medical variables,https://www.ncbi.nlm.nih.gov/pmc/articles/PMC10862005/
31300,More than 50 Long-term effects of COVID-19: a systematic review and meta-analysis,https://www.ncbi.nlm.nih.gov/pmc/articles/PMC7852236/
31301,Sci Rep. 2021; 11: 16144. ,https://www.ncbi.nlm.nih.gov/pmc/articles/PMC8352980/
31302,CT angiography of abdomen and pelvis in critically ill COVID-19 patients: imaging findings and correlation with the CT chest score,https://www.ncbi.nlm.nih.gov/pmc/articles/PMC8193959/
31303,"Exercise, Immune System, Nutrition, Respiratory and Cardiovascular Diseases during COVID-19: A Complex Combination",https://www.ncbi.nlm.nih.gov/pmc/articles/PMC7908487/
31304,"Recuperative herbal formula Jing Si maintains vasculature permeability balance, regulates inflammation and assuages concomitants of “Long-Covid”",https://www.ncbi.nlm.nih.gov/pmc/articles/PMC10130602/
31305,International Society of Blood Transfusion survey of experiences of blood banks and transfusion services during the COVID‐19 pandemic,https://www.ncbi.nlm.nih.gov/pmc/articles/PMC9115426/
31306,COVID-19 research in management: An updated bibliometric analysis,https://www.ncbi.nlm.nih.gov/pmc/articles/PMC9159974/
31307,Routine vaccination for influenza and pneumococcal disease and its effect on COVID-19 in a population of Dutch older adults,https://www.ncbi.nlm.nih.gov/pmc/articles/PMC10362126/
31308,Lived Experiences of Hemodialysis Health Care Workers during the COVID-19 Pandemic: A Qualitative Study from the Quebec Renal Network,https://www.ncbi.nlm.nih.gov/pmc/articles/PMC10103388/
31309,Neonatal intensive care unit preparedness for the Novel Coronavirus Disease-2019 pandemic: A New York City hospital perspective,https://www.ncbi.nlm.nih.gov/pmc/articles/PMC7221379/
31310,"Randomised, controlled, open label, multicentre clinical trial to explore safety and efficacy of hyperbaric oxygen for preventing ICU admission, morbidity and mortality in adult patients with COVID-19",https://www.ncbi.nlm.nih.gov/pmc/articles/PMC8260306/
31311,Healthcare workers’ perceptions and attitudes towards the UK’s COVID-19 vaccination programme: a rapid qualitative appraisal,https://www.ncbi.nlm.nih.gov/pmc/articles/PMC8852238/
31312,Generation of human tonsil epithelial organoids as an ex vivo model for SARS-CoV-2 infection,https://www.ncbi.nlm.nih.gov/pmc/articles/PMC8901203/
31313,"Low serum erythropoietin levels are associated with fatal COVID-19 cases at 4,150 meters above sea level",https://www.ncbi.nlm.nih.gov/pmc/articles/PMC8169280/
31314,"The effects of COVID-19 on agriculture supply chain, food security, and environment: a review",https://www.ncbi.nlm.nih.gov/pmc/articles/PMC11048076/
31315,COVID-19 in Cyanotic Congenital Heart Disease,https://www.ncbi.nlm.nih.gov/pmc/articles/PMC10129433/
31316,Blood donor motivators during the COVID‐19 pandemic,https://www.ncbi.nlm.nih.gov/pmc/articles/PMC9348007/
31317,Immunization against severe acute respiratory syndrome Coronavirus 2: an overview,https://www.ncbi.nlm.nih.gov/pmc/articles/PMC8889804/
31318,British Society of Gastroenterology guidance for management of inflammatory bowel disease during the COVID-19 pandemic,https://www.ncbi.nlm.nih.gov/pmc/articles/PMC7211081/
31319,Role of rehabilitation amidst the COVID-19 pandemic: a review,https://www.ncbi.nlm.nih.gov/pmc/articles/PMC8417619/
31320,"Exploring the Impact of COVID-19 on Physical Activity One Month after Infection and Its Potential Determinants: Re-Infections, Pre-Illness Vaccination Profiles/Types, and Beyond",https://www.ncbi.nlm.nih.gov/pmc/articles/PMC10538036/
31321,COVID-19-related stigma profiles and risk factors among people who are at high risk of contagion,https://www.ncbi.nlm.nih.gov/pmc/articles/PMC7540249/
31322,Compensatory Considerations for Radiological Emergency Response and Public Protective Actions during the COVID-19 Pandemic,https://www.ncbi.nlm.nih.gov/pmc/articles/PMC8745944/
31323,"Knowledge and attitude towards COVID-19 and its prevention in selected ten towns of SNNP Region, Ethiopia: Cross-sectional survey",https://www.ncbi.nlm.nih.gov/pmc/articles/PMC8345859/
31324,The Right to Health in Times of Pandemic: What Can We Learn from the UK’s Response to the COVID-19 Outbreak?,https://www.ncbi.nlm.nih.gov/pmc/articles/PMC7762905/
31325,"The Impact of the Different Stages of COVID-19, Time of the Week and Exercise Frequency on Mental Distress in Men and Women",https://www.ncbi.nlm.nih.gov/pmc/articles/PMC9268137/
31326,Human Factors and Airway Management in COVID-19 Patients: The Perfect Storm?,https://www.ncbi.nlm.nih.gov/pmc/articles/PMC9330625/
31327,Molecular Hydrogen Positively Affects Physical and Respiratory Function in Acute Post-COVID-19 Patients: A New Perspective in Rehabilitation,https://www.ncbi.nlm.nih.gov/pmc/articles/PMC8872486/
31328,"Pandemics, past and present: The role of biological anthropology in interdisciplinary pandemic studies",https://www.ncbi.nlm.nih.gov/pmc/articles/PMC9082061/
31329,Machine Learning and Deep Learning Approaches to Analyze and Detect COVID-19: A Review,https://www.ncbi.nlm.nih.gov/pmc/articles/PMC8056995/
31330,Perceived COVID‐19 health and job risks faced by digital platform drivers and measures in place to protect them: A qualitative study,https://www.ncbi.nlm.nih.gov/pmc/articles/PMC9349656/
31331,Return on Investment of the COVID-19 Vaccination Campaign in New York City,https://www.ncbi.nlm.nih.gov/pmc/articles/PMC9679875/
31332,The Impact of Halting Elective Admissions in Anticipation of a Demand Surge Due to the Coronavirus Pandemic (COVID-19),https://www.ncbi.nlm.nih.gov/pmc/articles/PMC7993651/
31333,"An in-depth analysis of 10 epidemiological terminologies used
in the context of COVID-19",https://www.ncbi.nlm.nih.gov/pmc/articles/PMC9361413/
31334,Ensemble multimodal deep learning for early diagnosis and accurate classification of COVID-19,https://www.ncbi.nlm.nih.gov/pmc/articles/PMC9485428/
31335,Illuminating and mitigating the evolving impacts of COVID-19 on ethnocultural communities: a participatory action mixed-methods study,https://www.ncbi.nlm.nih.gov/pmc/articles/PMC8367425/
31336,Determinants of the risk of burnout among nurses during the first wave of the COVID‐19 pandemic in Belgium: A cross‐sectional study,https://www.ncbi.nlm.nih.gov/pmc/articles/PMC9115243/
31337,"Multi-organ damage by covid-19: congestive (cardio-pulmonary) heart failure, and blood-heart barrier leakage",https://www.ncbi.nlm.nih.gov/pmc/articles/PMC7822399/
31338,Examining the impact of the first wave of COVID-19 and associated control measures on interventions to prevent blood-borne viruses among people who inject drugs in Scotland: an interrupted time series study,https://www.ncbi.nlm.nih.gov/pmc/articles/PMC8802039/
31339,Virtual system for early detection of COVID-19 infection “Etaware-CDT-2020 prototype design” (corroborated by rRT-PCR data),https://www.ncbi.nlm.nih.gov/pmc/articles/PMC8595498/
31340,Dentistry during the COVID-19 Epidemic: An Italian Workflow for the Management of Dental Practice,https://www.ncbi.nlm.nih.gov/pmc/articles/PMC7246688/
31341,Managing childhood allergies and immunodeficiencies during respiratory virus epidemics – The 2020 COVID‐19 pandemic: A statement from the EAACI‐section on pediatrics,https://www.ncbi.nlm.nih.gov/pmc/articles/PMC7264548/
31342,The effects of COVID-19 on sickness of medical staff across departments: A single centre experience,https://www.ncbi.nlm.nih.gov/pmc/articles/PMC8002809/
31343,Modeling COVID-19 epidemics in an Excel spreadsheet to enable first-hand accurate predictions of the pandemic evolution in urban areas,https://www.ncbi.nlm.nih.gov/pmc/articles/PMC7900250/
31344,The COVID-19 global crisis and corporate social responsibility,https://www.ncbi.nlm.nih.gov/pmc/articles/PMC9842497/
31345,The Influence of Microglia on Neuroplasticity and Long-Term Cognitive Sequelae in Long COVID: Impacts on Brain Development and Beyond,https://www.ncbi.nlm.nih.gov/pmc/articles/PMC11011312/
31346,"Novel 2019 coronavirus: Genome structure, clinical trials, and outstanding questions",https://www.ncbi.nlm.nih.gov/pmc/articles/PMC7327953/
31347,Registered clinical trials investigating treatment of long COVID: a scoping review and recommendations for research,https://www.ncbi.nlm.nih.gov/pmc/articles/PMC8935463/
31348,Drug repurposing of selective serotonin reuptake inhibitors: Could these drugs help fight COVID-19 and save lives?,https://www.ncbi.nlm.nih.gov/pmc/articles/PMC7973060/
31349,"Extracellular Vesicles: Versatile Nanomediators, Potential Biomarkers and Therapeutic Agents in Atherosclerosis and COVID-19-Related Thrombosis",https://www.ncbi.nlm.nih.gov/pmc/articles/PMC8198837/
31350,"Case Report of Serum Sickness-like Reaction following the First Dose of the Chimpanzee Adenovirus-Vectored AstraZeneca COVID-19 Vaccine, ChAdOx1",https://www.ncbi.nlm.nih.gov/pmc/articles/PMC9963129/
31351,The Reasons for Higher Mortality Rate in Opium Addicted Patients with COVID-19: A Narrative Review,https://www.ncbi.nlm.nih.gov/pmc/articles/PMC8214617/
31352,Current perspective on pandemic of COVID-19 in the United States,https://www.ncbi.nlm.nih.gov/pmc/articles/PMC7346962/
31353,Pathophysiological Changes in Erythrocytes Contributing to Complications of Inflammation and Coagulation in COVID-19,https://www.ncbi.nlm.nih.gov/pmc/articles/PMC9240594/
31354,"COVID‐19 and U.S. Disputes Over Authority, 2020–2021: Implications for the Constructionist Analysis of Social Problems",https://www.ncbi.nlm.nih.gov/pmc/articles/PMC9538751/
31355,Practice Recommendations for Risk-Adapted Head and Neck Cancer Radiation Therapy During the COVID-19 Pandemic: An ASTRO-ESTRO Consensus Statement,https://www.ncbi.nlm.nih.gov/pmc/articles/PMC7194855/
31356,Suffering and Salutogenesis: A Conceptual Analysis of Lessons for Psychiatry From Existential Positive Psychology (PP2.0) in the Setting of the COVID-19 Pandemic,https://www.ncbi.nlm.nih.gov/pmc/articles/PMC8064119/
31357,Stress management protocol for nurses working in the COVID-19 wards,https://www.ncbi.nlm.nih.gov/pmc/articles/PMC10125915/
31358,Hashimoto’s thyroiditis-related myopathy in a patient with SARS-CoV-2 infection: A case report and systematic literature review,https://www.ncbi.nlm.nih.gov/pmc/articles/PMC10589518/
31359,A description of the COVID-19 outbreak role in financial risk forecasting,https://www.ncbi.nlm.nih.gov/pmc/articles/PMC9985442/
31360,COVID-19 related maternal mortality cases in associated with Delta and Omicron waves and the role of lung ultrasound,https://www.ncbi.nlm.nih.gov/pmc/articles/PMC9249361/
31361,Comparison and Sensitivity Evaluation of Three Different Commercial Real-Time Quantitative PCR Kits for SARS-CoV-2 Detection,https://www.ncbi.nlm.nih.gov/pmc/articles/PMC8309997/
31362,Current State of the First COVID-19 Vaccines,https://www.ncbi.nlm.nih.gov/pmc/articles/PMC7826947/
31363,Erythropoietin as candidate for supportive treatment of severe COVID-19,https://www.ncbi.nlm.nih.gov/pmc/articles/PMC7297268/
31364,Resilience during uncertainty? Greater social connectedness during COVID‐19 lockdown is associated with reduced distress and fatigue,https://www.ncbi.nlm.nih.gov/pmc/articles/PMC8247344/
31365,Omicron (B.1.1.529) variant and its subvariants and lineages may lead to another COVID-19 wave in the world? -An overview of current evidence and counteracting strategies,https://www.ncbi.nlm.nih.gov/pmc/articles/PMC10192062/
31366,On BCG Vaccine Protection from COVID-19: A Review,https://www.ncbi.nlm.nih.gov/pmc/articles/PMC7956872/
31367,Effect of corticosteroid therapy on mortality in COVID‐19 patients—A systematic review and meta‐analysis,https://www.ncbi.nlm.nih.gov/pmc/articles/PMC9538928/
31368,Methylene Blue Inhibits the SARS-CoV-2 Spike–ACE2 Protein-Protein Interaction–a Mechanism that can Contribute to its Antiviral Activity Against COVID-19,https://www.ncbi.nlm.nih.gov/pmc/articles/PMC7838506/
31369,A review of modern technologies for tackling COVID-19 pandemic,https://www.ncbi.nlm.nih.gov/pmc/articles/PMC7204706/
31370,Psychosocial Distress among Family Members of COVID-19 Patients Admitted to Hospital and Isolation Facilities in the Philippines: A Prospective Cohort Study,https://www.ncbi.nlm.nih.gov/pmc/articles/PMC9457412/
31371,Linking sporadic hospital clusters during a community surge of the severe acute respiratory coronavirus virus 2 (SARS-CoV-2) B.1.617.2 delta variant: The utility of whole-genome sequencing,https://www.ncbi.nlm.nih.gov/pmc/articles/PMC10262163/
31372,Self-management of the dual diagnosis of HIV and diabetes during COVID-19: a qualitative study,https://www.ncbi.nlm.nih.gov/pmc/articles/PMC9237177/
31373,Lived sexual experience of health workers on the Iranian frontline of the fight against the COVID-19 pandemic: A qualitative content analysis,https://www.ncbi.nlm.nih.gov/pmc/articles/PMC10407152/
31374,Methods for detecting probable COVID-19 cases from large-scale survey data also reveal probable sex differences in symptom profiles,https://www.ncbi.nlm.nih.gov/pmc/articles/PMC9685297/
31375,Efficacy of chloroquine and hydroxychloroquine in treating COVID-19 infection: A meta-review of systematic reviews and an updated meta-analysis,https://www.ncbi.nlm.nih.gov/pmc/articles/PMC8273040/
31376,Chest Physiotherapy Interventions for Children During SARS-COV-2 Pandemic,https://www.ncbi.nlm.nih.gov/pmc/articles/PMC10133862/
31377,Evaluation of anti-COVID-19 measures taken by the parents of children with celiac disease: a cross-sectional study,https://www.ncbi.nlm.nih.gov/pmc/articles/PMC9625009/
31378,Adverse Reactions of COVID-19 Vaccines: A Scoping Review of Observational Studies,https://www.ncbi.nlm.nih.gov/pmc/articles/PMC9951602/
31379,Two-step machine learning to diagnose and predict involvement of lungs in COVID-19 and pneumonia using CT radiomics,https://www.ncbi.nlm.nih.gov/pmc/articles/PMC9533634/
31380,"Independent control of COVID-19 vaccines by EU Official Control Authority Batch Release: challenges, strengths and successes",https://www.ncbi.nlm.nih.gov/pmc/articles/PMC9950138/
31381,Suramin Inhibits SARS-CoV-2 Infection in Cell Culture by Interfering with Early Steps of the Replication Cycle,https://www.ncbi.nlm.nih.gov/pmc/articles/PMC7526844/
31382,COVID-19 Anti-Vaccine Sentiments: Analyses of Comments from Social Media,https://www.ncbi.nlm.nih.gov/pmc/articles/PMC8622531/
31383,Hybrid simulation modelling of networks of heterogeneous care homes and the inter-facility spread of Covid-19 by sharing staff,https://www.ncbi.nlm.nih.gov/pmc/articles/PMC8789158/
31384,Assessment of Qatar’s Health Care Community Call Center Efficacy in Addressing COVID-19 Pandemic Health Care Challenges: Cross-Sectional Study,https://www.ncbi.nlm.nih.gov/pmc/articles/PMC10798346/
31385,The impact of COVID-19 on the wellbeing of the UK nursing and midwifery workforce during the first pandemic wave: A longitudinal survey study,https://www.ncbi.nlm.nih.gov/pmc/articles/PMC8673915/
31386,The impact of COVID-19 on abortion access: Insights from the European Union and the United Kingdom,https://www.ncbi.nlm.nih.gov/pmc/articles/PMC8674116/
31387,“We All Really Need to just Take a Breath”: Composite Narratives of Hospital Doctors’ Well-Being during the COVID-19 Pandemic,https://www.ncbi.nlm.nih.gov/pmc/articles/PMC7921910/
31388,Effect of health anxiety on disease perception and treatment compliance in elderly patients during the COVID-19 pandemic in Turkey,https://www.ncbi.nlm.nih.gov/pmc/articles/PMC9119737/
31389,"The public health impact of poor sleep on severe COVID-19, influenza and upper respiratory infections",https://www.ncbi.nlm.nih.gov/pmc/articles/PMC8863167/
31390,Sleep Med. 2022 Dec; 100: S135. ,https://www.ncbi.nlm.nih.gov/pmc/articles/PMC9300252/
31391,The Impact of Job Stress and State Anger on Turnover Intention Among Nurses During COVID-19: The Mediating Role of Emotional Exhaustion,https://www.ncbi.nlm.nih.gov/pmc/articles/PMC8863937/
31392,COVID-19 in Workplace Settings: Lessons Learned for Occupational Medicine in the UK,https://www.ncbi.nlm.nih.gov/pmc/articles/PMC10731572/
31393,Understanding advance care planning in care homes throughout the COVID-19 pandemic: A critical realist review and synthesis,https://www.ncbi.nlm.nih.gov/pmc/articles/PMC9659704/
31394,Prevalence and Factors Associated with Parents’ Non-Intention to Vaccinate Their Children and Adolescents against COVID-19 in Latin America and the Caribbean,https://www.ncbi.nlm.nih.gov/pmc/articles/PMC8624413/
31395,Antiviral peptides from aquatic organisms: Functionality and potential inhibitory effect on SARS-CoV-2,https://www.ncbi.nlm.nih.gov/pmc/articles/PMC8049179/
31396,"COVID-19 and Mortality, Depression, and Suicide in the Polish Population",https://www.ncbi.nlm.nih.gov/pmc/articles/PMC8965814/
31397,FWLICM-Deep Learning: Fuzzy Weighted Local Information C-Means Clustering-Based Lung Lobe Segmentation with Deep Learning for COVID-19 Detection,https://www.ncbi.nlm.nih.gov/pmc/articles/PMC9255540/
31398,COVID-19 Prevalence and Prevention Behaviors Among US Certified Organic Producers,https://www.ncbi.nlm.nih.gov/pmc/articles/PMC8630927/
31399,Parental Perceptions and Barriers towards Childhood COVID-19 Vaccination in Saudi Arabia: A Cross-Sectional Analysis,https://www.ncbi.nlm.nih.gov/pmc/articles/PMC9785967/
31400,COVID-Related suicide during the second wave of COVID-19 pandemic in India: A tip of the iceberg of mental health problems,https://www.ncbi.nlm.nih.gov/pmc/articles/PMC9638676/
31401,Ensuring that COVID-19 research is inclusive: guidance from the NIHR INCLUDE project,https://www.ncbi.nlm.nih.gov/pmc/articles/PMC7646322/
31402,COVID-19 and Treatment and Immunization of Children—The Time to Redefine Pediatric Age Groups is Here,https://www.ncbi.nlm.nih.gov/pmc/articles/PMC8092959/
31403,Multiple sclerosis and COVID‐19: The Swedish experience,https://www.ncbi.nlm.nih.gov/pmc/articles/PMC8222873/
31404,Do environmental pollutants carrier to COVID-19 pandemic? A cross-sectional analysis,https://www.ncbi.nlm.nih.gov/pmc/articles/PMC8526356/
31405,Spike Protein Impairs Mitochondrial Function in Human Cardiomyocytes: Mechanisms Underlying Cardiac Injury in COVID-19,https://www.ncbi.nlm.nih.gov/pmc/articles/PMC10046940/
